Title,Abstract,StoreId,ArticleType,Authors,copyright,digitalObjectIdentifier,documentType,entryDate,issn,language,languageOfSummary,pages,placeOfPublication,pubdate,pubtitle,year,DocumentURL,startPage,FindACopy,Database
THE CAPTURE OF NEW-ORLEANS,"A special dispatch to the Times, from Fort Wright, 28th, says:",91677153,Historical Newspapers," NEWS RECEIVED UP THE MISSISSIPPI.
NEWS RECEIVED UP THE MISSISSIPPI."," Copyright New York Times Company Apr 30, 1862"," 78687482 , 1445943 , 113715", front_page," Apr 30, 1862",0362-4331, English, English, 1," New York, N.Y.","Apr 30, 1862",New York Times (1857-1922),1862,http://search.proquest.com/docview/91677153?accountid=13567, 1,http://openurl.lib.rochester.edu/find?ctx_ver=Z39.88-2004&amp;ctx_enc=info:ofi/enc:UTF-8&amp;rfr_id=info:sid/ProQ%3Ahnpnewyorktimeswindex&amp;rft_val_fmt=info:ofi/fmt:kev:mtx:journal&amp;rft.genre=unknown&amp;rft.jtitle=New+York+Times+%281857-1922%29&amp;rft.atitle=THE+CAPTURE+OF+NEW-ORLEANS%3A+SURRENDER+OF+THE+CITY+WITHOUT+RESISTANCE.+RETIREMENT+OF+GEN.+LOVEL+WITH+HIS+FORCES+BY+THE+JACKSON+RAILROAD.+TERRIFIC+FIGHTING+FOR+TWO+DAYS+BELOW+THE+CITY.+THE+NATIONAL+LOSS+REPORTED+TO+BE+HEAVY.+REBEL+ACCOUNT+OF+THE+BOMBARDMENT+OF+FORT+JACKSON.&amp;rft.au=NEWS+RECEIVED+UP+THE+MISSISSIPPI.&amp;rft.aulast=NEWS+RECEIVED+UP+THE+MISSISSIPPI.&amp;rft.aufirst=&amp;rft.date=1862-04-30&amp;rft.volume=&amp;rft.issue=&amp;rft.spage=1&amp;rft.isbn=&amp;rft.btitle=&amp;rft.title=New+York+Times+%281857-1922%29&amp;rft.issn=03624331,ProQuest Historical Newspapers: The New York Times (1851-2009) with Index (1851-1993)
THE BOMBARDMENT OF FORT JACKSON.,,91682197,Historical Newspapers,," Copyright New York Times Company Apr 30, 1862"," 78687485 , 1445943 , 113715", front_page," Apr 30, 1862",0362-4331, English, English, 1," New York, N.Y.","Apr 30, 1862",New York Times (1857-1922),1862,http://search.proquest.com/docview/91682197?accountid=13567, 1,http://openurl.lib.rochester.edu/find?ctx_ver=Z39.88-2004&amp;ctx_enc=info:ofi/enc:UTF-8&amp;rfr_id=info:sid/ProQ%3Ahnpnewyorktimeswindex&amp;rft_val_fmt=info:ofi/fmt:kev:mtx:journal&amp;rft.genre=unknown&amp;rft.jtitle=New+York+Times+%281857-1922%29&amp;rft.atitle=THE+BOMBARDMENT+OF+FORT+JACKSON.%3A+WHAT+THE+REBELS+SAID+ABOUT+IT.&amp;rft.au=&amp;rft.aulast=&amp;rft.aufirst=&amp;rft.date=1862-04-30&amp;rft.volume=&amp;rft.issue=&amp;rft.spage=1&amp;rft.isbn=&amp;rft.btitle=&amp;rft.title=New+York+Times+%281857-1922%29&amp;rft.issn=03624331,ProQuest Historical Newspapers: The New York Times (1851-2009) with Index (1851-1993)
FROM GEN. HALLECK'S ARMY.,,91729617,Historical Newspapers,," Copyright New York Times Company Apr 30, 1862"," 78687494-1 , 1445943 , 113715", front_page," Apr 30, 1862",0362-4331, English, English, 1," New York, N.Y.","Apr 30, 1862",New York Times (1857-1922),1862,http://search.proquest.com/docview/91729617?accountid=13567, 1,http://openurl.lib.rochester.edu/find?ctx_ver=Z39.88-2004&amp;ctx_enc=info:ofi/enc:UTF-8&amp;rfr_id=info:sid/ProQ%3Ahnpnewyorktimeswindex&amp;rft_val_fmt=info:ofi/fmt:kev:mtx:journal&amp;rft.genre=unknown&amp;rft.jtitle=New+York+Times+%281857-1922%29&amp;rft.atitle=FROM+GEN.+HALLECK%27S+ARMY.%3A+A+SUCCESSFUL+CAVALRY+SKIRMISH+NEAR+CORINTH.+FIVE+REBELS+KILLED+AND+NINETEEN+TAKEN+PRISONERS.+IMMINENCE+OF+ANOTHER+GREAT+BATTLE.+THE+FALL+OF+NEW-ORLEANS+KNOWN+TO+THE+REBEL+ARMY.&amp;rft.au=&amp;rft.aulast=&amp;rft.aufirst=&amp;rft.date=1862-04-30&amp;rft.volume=&amp;rft.issue=&amp;rft.spage=1&amp;rft.isbn=&amp;rft.btitle=&amp;rft.title=New+York+Times+%281857-1922%29&amp;rft.issn=03624331,ProQuest Historical Newspapers: The New York Times (1851-2009) with Index (1851-1993)
LETTERS FROM OUR SPECIAL CORRESPONDENT.,"The destination of Commodore PORTER'S mor- tar flotilla is no longer a secret. It is bound to the Crescent City. The bomb-schooners are now anchored within the Mississippi Passes, and the large naval fleet of Commodore FARRAGUT, which is to operate conjointly with them, is also here, or hovering along the coast not far away, in readiness for entering the river at the shortest notice.",91730911,Historical Newspapers,," Copyright New York Times Company Apr 29, 1862"," 78687325-1 , 1445942 , 113715", front_page," Apr 29, 1862",0362-4331, English, English, 1," New York, N.Y.","Apr 29, 1862",New York Times (1857-1922),1862,http://search.proquest.com/docview/91730911?accountid=13567, 1,http://openurl.lib.rochester.edu/find?ctx_ver=Z39.88-2004&amp;ctx_enc=info:ofi/enc:UTF-8&amp;rfr_id=info:sid/ProQ%3Ahnpnewyorktimeswindex&amp;rft_val_fmt=info:ofi/fmt:kev:mtx:journal&amp;rft.genre=unknown&amp;rft.jtitle=New+York+Times+%281857-1922%29&amp;rft.atitle=LETTERS+FROM+OUR+SPECIAL+CORRESPONDENT.&amp;rft.au=&amp;rft.aulast=&amp;rft.aufirst=&amp;rft.date=1862-04-29&amp;rft.volume=&amp;rft.issue=&amp;rft.spage=1&amp;rft.isbn=&amp;rft.btitle=&amp;rft.title=New+York+Times+%281857-1922%29&amp;rft.issn=03624331,ProQuest Historical Newspapers: The New York Times (1851-2009) with Index (1851-1993)
THE NEWS FULLY CONFIRMED.,,91731878,Historical Newspapers,," Copyright New York Times Company Apr 29, 1862"," 78687321 , 1445942 , 113715", front_page," Apr 29, 1862",0362-4331, English, English, 1," New York, N.Y.","Apr 29, 1862",New York Times (1857-1922),1862,http://search.proquest.com/docview/91731878?accountid=13567, 1,http://openurl.lib.rochester.edu/find?ctx_ver=Z39.88-2004&amp;ctx_enc=info:ofi/enc:UTF-8&amp;rfr_id=info:sid/ProQ%3Ahnpnewyorktimeswindex&amp;rft_val_fmt=info:ofi/fmt:kev:mtx:journal&amp;rft.genre=unknown&amp;rft.jtitle=New+York+Times+%281857-1922%29&amp;rft.atitle=THE+NEWS+FULLY+CONFIRMED.%3A+THE+CITY+OF+NEW-ORLEANS+OCCUPIED+BY+THE+NATIONAL+FORCES.&amp;rft.au=&amp;rft.aulast=&amp;rft.aufirst=&amp;rft.date=1862-04-29&amp;rft.volume=&amp;rft.issue=&amp;rft.spage=1&amp;rft.isbn=&amp;rft.btitle=&amp;rft.title=New+York+Times+%281857-1922%29&amp;rft.issn=03624331,ProQuest Historical Newspapers: The New York Times (1851-2009) with Index (1851-1993)
THE NEWS IN WASHINGTON.,"The city is wild with rejoicing to-night over the news of the advance of our gunboats upon New-Orleans, in spite of the resistance of Forts Jackson and Philip, and the probable surrender of that city from the vile clutches of rebeldom, and its return to loyalty and trade with all the world. New-Orleans is probably in possession of Gen. BUTLER at present writing. The President is in high glee over the news.",91667066,Historical Newspapers,," Copyright New York Times Company Apr 28, 1862"," 78687066 , 1445941 , 113715", front_page," Apr 28, 1862",0362-4331, English, English, 1," New York, N.Y.","Apr 28, 1862",New York Times (1857-1922),1862,http://search.proquest.com/docview/91667066?accountid=13567, 1,http://openurl.lib.rochester.edu/find?ctx_ver=Z39.88-2004&amp;ctx_enc=info:ofi/enc:UTF-8&amp;rfr_id=info:sid/ProQ%3Ahnpnewyorktimeswindex&amp;rft_val_fmt=info:ofi/fmt:kev:mtx:journal&amp;rft.genre=unknown&amp;rft.jtitle=New+York+Times+%281857-1922%29&amp;rft.atitle=THE+NEWS+IN+WASHINGTON.%3A+FROM+ANOTHER+CORRESPONDENT.&amp;rft.au=&amp;rft.aulast=&amp;rft.aufirst=&amp;rft.date=1862-04-28&amp;rft.volume=&amp;rft.issue=&amp;rft.spage=1&amp;rft.isbn=&amp;rft.btitle=&amp;rft.title=New+York+Times+%281857-1922%29&amp;rft.issn=03624331,ProQuest Historical Newspapers: The New York Times (1851-2009) with Index (1851-1993)
THE CAPTURE OF NEW-ORLEANS BY THE BUTLER EXPEDITION.,,91731030,Historical Newspapers,," Copyright New York Times Company Apr 28, 1862"," 78687093-1 , 1445941 , 113715", front_page," Apr 28, 1862",0362-4331, English, English, 1," New York, N.Y.","Apr 28, 1862",New York Times (1857-1922),1862,http://search.proquest.com/docview/91731030?accountid=13567, 1,http://openurl.lib.rochester.edu/find?ctx_ver=Z39.88-2004&amp;ctx_enc=info:ofi/enc:UTF-8&amp;rfr_id=info:sid/ProQ%3Ahnpnewyorktimeswindex&amp;rft_val_fmt=info:ofi/fmt:kev:mtx:journal&amp;rft.genre=unknown&amp;rft.jtitle=New+York+Times+%281857-1922%29&amp;rft.atitle=THE+CAPTURE+OF+NEW-ORLEANS+BY+THE+BUTLER+EXPEDITION.%3A+MAP+SHOWING+THE+TOPOGRAPHY+OF+NEW-ORLEANS+AND+THE+SURROUNDING+COUNTRY%2C+WITH+THE+LINE+OF+THE+MISSISSIPPI+RIVER+FROM+ITS+DEBOUCHURE+TO+THE+CITY.&amp;rft.au=&amp;rft.aulast=&amp;rft.aufirst=&amp;rft.date=1862-04-28&amp;rft.volume=&amp;rft.issue=&amp;rft.spage=1&amp;rft.isbn=&amp;rft.btitle=&amp;rft.title=New+York+Times+%281857-1922%29&amp;rft.issn=03624331,ProQuest Historical Newspapers: The New York Times (1851-2009) with Index (1851-1993)
NEW-ORLEANS OURS!,"Hon, E.M. Stanton, Secretary of War: A fugitive black, just arrived from Portsmouth, brings the Petersburgh Express of yesterday, which contains the following dispatch:",91732130,Historical Newspapers,," Copyright New York Times Company Apr 28, 1862"," 78687056 , 1445941 , 113715", front_page," Apr 28, 1862",0362-4331, English, English, 1," New York, N.Y.","Apr 28, 1862",New York Times (1857-1922),1862,http://search.proquest.com/docview/91732130?accountid=13567, 1,http://openurl.lib.rochester.edu/find?ctx_ver=Z39.88-2004&amp;ctx_enc=info:ofi/enc:UTF-8&amp;rfr_id=info:sid/ProQ%3Ahnpnewyorktimeswindex&amp;rft_val_fmt=info:ofi/fmt:kev:mtx:journal&amp;rft.genre=unknown&amp;rft.jtitle=New+York+Times+%281857-1922%29&amp;rft.atitle=NEW-ORLEANS+OURS%21%3A+ACKNOWLEDGMENT+OF+ITS+CAPTURE+BY+THE+REBELS.+DISPATCHES+FROM+GEN.+WOOL+AND+GEN.+MCDOWELL.+FORT+JACKSON+PASSED+BY+OUR+FORCES+ON+THURSDAY+MORNING.+GREAT+EXCITEMENT+IN+THE+CITY.+STRICT+MARTIAL+LAW+AT+ONCE+PROCLAIMED.+COTTON+AND+STEAMBOATS+REPORTED+TO+BE+BURNT.+THE+NATIONAL+FORCES+BEFORE+THE+CITY+ON+FRIDAY+AT+NOON.+LAST+GASP+OF+THE+REBEL+TELEGRAPH+OPERATOR.+DISPATCH+FROM+GEN.+WOOL.&amp;rft.au=&amp;rft.aulast=&amp;rft.aufirst=&amp;rft.date=1862-04-28&amp;rft.volume=&amp;rft.issue=&amp;rft.spage=1&amp;rft.isbn=&amp;rft.btitle=&amp;rft.title=New+York+Times+%281857-1922%29&amp;rft.issn=03624331,ProQuest Historical Newspapers: The New York Times (1851-2009) with Index (1851-1993)
IMPORTANT FROM SHIP ISLAND.,"The ship Black Prince, Capt. HOWES, arrived here this morning, from Ship Island 6th inst., vid Havana 15%, where she touched by convey Government dispotches to the United States Consul at that port. She also brings a large mail to this port.",91667124,Historical Newspapers,," Copyright New York Times Company Apr 28, 1862"," 78687069 , 1445941 , 113715", front_page," Apr 28, 1862",0362-4331, English, English, 1," New York, N.Y.","Apr 28, 1862",New York Times (1857-1922),1862,http://search.proquest.com/docview/91667124?accountid=13567, 1,http://openurl.lib.rochester.edu/find?ctx_ver=Z39.88-2004&amp;ctx_enc=info:ofi/enc:UTF-8&amp;rfr_id=info:sid/ProQ%3Ahnpnewyorktimeswindex&amp;rft_val_fmt=info:ofi/fmt:kev:mtx:journal&amp;rft.genre=unknown&amp;rft.jtitle=New+York+Times+%281857-1922%29&amp;rft.atitle=IMPORTANT+FROM+SHIP+ISLAND.%3A+ACTIVITY+IN+MILITARY+AND+NAVAL+MOVEMENTS--THE+EXPECTED+ATTACK+ON+NEW-ORLEANS--GEN.+BUTLER%27S+FORCED+TO+GO+THROUGH+THE+LAKES%2C+%26C.&amp;rft.au=&amp;rft.aulast=&amp;rft.aufirst=&amp;rft.date=1862-04-28&amp;rft.volume=&amp;rft.issue=&amp;rft.spage=1&amp;rft.isbn=&amp;rft.btitle=&amp;rft.title=New+York+Times+%281857-1922%29&amp;rft.issn=03624331,ProQuest Historical Newspapers: The New York Times (1851-2009) with Index (1851-1993)
THE CAPTURE OF NEW-ORLEANS.,"The new of the capture of New-Orleans which we received from the South at a late hour last night, clears up gloriously the mystery which for some time has hung around the movements of our navy and army upon the Lower Mississippi. We had already had intelligence that our bumbkotches had opened fire upon Fort Jackson, 60 miles below the city, and yesterday morning we published news derived from the rebels that one of our gunboats had run past that work.",91723564,Historical Newspapers,," Copyright New York Times Company Apr 28, 1862"," 78687062 , 1445941 , 113715", front_page," Apr 28, 1862",0362-4331, English, English, 1," New York, N.Y.","Apr 28, 1862",New York Times (1857-1922),1862,http://search.proquest.com/docview/91723564?accountid=13567, 1,http://openurl.lib.rochester.edu/find?ctx_ver=Z39.88-2004&amp;ctx_enc=info:ofi/enc:UTF-8&amp;rfr_id=info:sid/ProQ%3Ahnpnewyorktimeswindex&amp;rft_val_fmt=info:ofi/fmt:kev:mtx:journal&amp;rft.genre=unknown&amp;rft.jtitle=New+York+Times+%281857-1922%29&amp;rft.atitle=THE+CAPTURE+OF+NEW-ORLEANS.&amp;rft.au=&amp;rft.aulast=&amp;rft.aufirst=&amp;rft.date=1862-04-28&amp;rft.volume=&amp;rft.issue=&amp;rft.spage=1&amp;rft.isbn=&amp;rft.btitle=&amp;rft.title=New+York+Times+%281857-1922%29&amp;rft.issn=03624331,ProQuest Historical Newspapers: The New York Times (1851-2009) with Index (1851-1993)
OPERATIONS AGAINST NEW-ORLEANS.,"The Richmond Examiner of the 25th announces that one of our gunboats passed Fort Jackson and Fort Philip, sixty miles below New-Orleans, on the 24th. The report was telegraphed to Norfolk, and brought to Fortress Monroe under flag of truce, and received from there to-day by the Navy Department.",91730116,Historical Newspapers," SPECIAL DISPATCH FROM WASHINGTON.FROM ANOTHER CORRESPONDENT.
SPECIAL DISPATCH FROM WASHINGTON.FROM ANOTHER CORRESPONDENT."," Copyright New York Times Company Apr 27, 1862"," 78686761-1 , 1445936 , 113715", front_page," Apr 27, 1862",0362-4331, English, English, 1," New York, N.Y.","Apr 27, 1862",New York Times (1857-1922),1862,http://search.proquest.com/docview/91730116?accountid=13567, 1,http://openurl.lib.rochester.edu/find?ctx_ver=Z39.88-2004&amp;ctx_enc=info:ofi/enc:UTF-8&amp;rfr_id=info:sid/ProQ%3Ahnpnewyorktimeswindex&amp;rft_val_fmt=info:ofi/fmt:kev:mtx:journal&amp;rft.genre=unknown&amp;rft.jtitle=New+York+Times+%281857-1922%29&amp;rft.atitle=OPERATIONS+AGAINST+NEW-ORLEANS.%3A+AN+IMPORTANT+REPORT+FROM+THE+REBELS.+ONE+OF+OUR+GUNBOATS+ABOVE+FORTS+JACKSON+AND+PHILIP.+MOVEMENT+OF+NATIONAL+FORCES+FROM+SHIP+ISLAND.&amp;rft.au=SPECIAL+DISPATCH+FROM+WASHINGTON.FROM+ANOTHER+CORRESPONDENT.&amp;rft.aulast=SPECIAL+DISPATCH+FROM+WASHINGTON.FROM+ANOTHER+CORRESPONDENT.&amp;rft.aufirst=&amp;rft.date=1862-04-27&amp;rft.volume=&amp;rft.issue=&amp;rft.spage=1&amp;rft.isbn=&amp;rft.btitle=&amp;rft.title=New+York+Times+%281857-1922%29&amp;rft.issn=03624331,ProQuest Historical Newspapers: The New York Times (1851-2009) with Index (1851-1993)
OUR KEY WEST CORRESPONDENCE.,,91725956,Historical Newspapers,," Copyright New York Times Company Apr 27, 1862"," 78686763 , 1445936 , 113715", front_page," Apr 27, 1862",0362-4331, English, English, 1," New York, N.Y.","Apr 27, 1862",New York Times (1857-1922),1862,http://search.proquest.com/docview/91725956?accountid=13567, 1,http://openurl.lib.rochester.edu/find?ctx_ver=Z39.88-2004&amp;ctx_enc=info:ofi/enc:UTF-8&amp;rfr_id=info:sid/ProQ%3Ahnpnewyorktimeswindex&amp;rft_val_fmt=info:ofi/fmt:kev:mtx:journal&amp;rft.genre=unknown&amp;rft.jtitle=New+York+Times+%281857-1922%29&amp;rft.atitle=OUR+KEY+WEST+CORRESPONDENCE.%3A+OPERATIONS+AGAINST+NEW-ORLEANS--THE+MORTAR+FLEET+IN+THE+RIVER--ARRIVALS+AND+CLEARANCES..&amp;rft.au=&amp;rft.aulast=&amp;rft.aufirst=&amp;rft.date=1862-04-27&amp;rft.volume=&amp;rft.issue=&amp;rft.spage=1&amp;rft.isbn=&amp;rft.btitle=&amp;rft.title=New+York+Times+%281857-1922%29&amp;rft.issn=03624331,ProQuest Historical Newspapers: The New York Times (1851-2009) with Index (1851-1993)
LATEST FROM NEW-ORLEANS,"SIR: The Norfolk Day-Book reports a heavy bombardment at Fort Jackson, on the Mississippi River. Major-Gen. Lovell is represented as saying ""it was terrific."" It was still continued at the last advices.",570632084,Historical Newspapers,," Copyright IHT Corporation Apr 26, 1862"," 1434539622 , 23783862 , 73093", article," Apr 26, 1862",, English, English,," New York, N.Y.","Apr 26, 1862",New - York Daily Tribune (1842-1866),1862,http://search.proquest.com/docview/570632084?accountid=13567, 8,http://openurl.lib.rochester.edu/find?ctx_ver=Z39.88-2004&amp;ctx_enc=info:ofi/enc:UTF-8&amp;rfr_id=info:sid/ProQ%3Ahnpnewyorktribunefull&amp;rft_val_fmt=info:ofi/fmt:kev:mtx:journal&amp;rft.genre=article&amp;rft.jtitle=New+-+York+Daily+Tribune+%281842-1866%29&amp;rft.atitle=LATEST+FROM+NEW-ORLEANS%3A+COM.+PORTER%27S+FLEET+AT+WORK+ATTACK+ON+FT.+JACKSON+A+TERRIFIC+BOMBARDMENT+25%2C000+18-INCH+SHELLS+DISCHARGED+THE+REBELS+STILL+HOLD+OUT+DISPATCHES+FROM+GEN.+WOOL+AND+ASSISTANT+SECRETARY+TUCKER+FROM+FORTRESS+MONROE+FROM+GEN.+MITCHEL%27S+DIVISION+ADVANCE+INTO+DIXIE--CAPTURE+OF+HUNTSVILLE+AND+DECATUR--LARGE+AMOUNT+OF+PROPERTY+TAKEN--IMPORTANT+DISPATCH+FROM+BEAUREGARD+INTERCEPTED+INTERCEPTED+DISPATCH+PROM+BEAUREGARD&amp;rft.au=&amp;rft.aulast=&amp;rft.aufirst=&amp;rft.date=1862-04-26&amp;rft.volume=&amp;rft.issue=&amp;rft.spage=8&amp;rft.isbn=&amp;rft.btitle=&amp;rft.title=New+-+York+Daily+Tribune+%281842-1866%29&amp;rft.issn=,ProQuest Historical Newspapers: New York Tribune / Herald Tribune  (1841-1962)
OPERATIONS BELOW NEW-ORLEANS,,91756933,Historical Newspapers,," Copyright New York Times Company Apr 26, 1862"," 78686659-1 , 1445935 , 113715", front_page," Apr 26, 1862",0362-4331, English, English, 1," New York, N.Y.","Apr 26, 1862",New York Times (1857-1922),1862,http://search.proquest.com/docview/91756933?accountid=13567, 1,http://openurl.lib.rochester.edu/find?ctx_ver=Z39.88-2004&amp;ctx_enc=info:ofi/enc:UTF-8&amp;rfr_id=info:sid/ProQ%3Ahnpnewyorktimeswindex&amp;rft_val_fmt=info:ofi/fmt:kev:mtx:journal&amp;rft.genre=unknown&amp;rft.jtitle=New+York+Times+%281857-1922%29&amp;rft.atitle=OPERATIONS+BELOW+NEW-ORLEANS%3A+BOMBARDMENT+OF+FORT+JACKSON+BY+THE+NATIONAL+FLOTILLA.+REPORTS+FROM+THE+REBELS+THE+FIRING+DESCRIBED+AS+TERRIFIC.+DISPATCHES+TO+THE+WAR+DEPARTMENT.&amp;rft.au=&amp;rft.aulast=&amp;rft.aufirst=&amp;rft.date=1862-04-26&amp;rft.volume=&amp;rft.issue=&amp;rft.spage=1&amp;rft.isbn=&amp;rft.btitle=&amp;rft.title=New+York+Times+%281857-1922%29&amp;rft.issn=03624331,ProQuest Historical Newspapers: The New York Times (1851-2009) with Index (1851-1993)
ACTIVE OPERATIONS BEGUN AGAINST THE DEFENCES OF NEW-ORLEANS,,91724833,Historical Newspapers,," Copyright New York Times Company Apr 26, 1862"," 78686710 , 1445935 , 113715", article," Apr 26, 1862",0362-4331, English, English, 4," New York, N.Y.","Apr 26, 1862",New York Times (1857-1922),1862,http://search.proquest.com/docview/91724833?accountid=13567, 4,http://openurl.lib.rochester.edu/find?ctx_ver=Z39.88-2004&amp;ctx_enc=info:ofi/enc:UTF-8&amp;rfr_id=info:sid/ProQ%3Ahnpnewyorktimeswindex&amp;rft_val_fmt=info:ofi/fmt:kev:mtx:journal&amp;rft.genre=article&amp;rft.jtitle=New+York+Times+%281857-1922%29&amp;rft.atitle=ACTIVE+OPERATIONS+BEGUN+AGAINST+THE+DEFENCES+OF+NEW-ORLEANS&amp;rft.au=&amp;rft.aulast=&amp;rft.aufirst=&amp;rft.date=1862-04-26&amp;rft.volume=&amp;rft.issue=&amp;rft.spage=4&amp;rft.isbn=&amp;rft.btitle=&amp;rft.title=New+York+Times+%281857-1922%29&amp;rft.issn=03624331,ProQuest Historical Newspapers: The New York Times (1851-2009) with Index (1851-1993)
"IMPORTANT FROM NEW-ORLEANS,",By an arrival at this port yesterday we have received our Havana files to the 17th instant.,91646181,Historical Newspapers,," Copyright New York Times Company Apr 25, 1862"," 78686566 , 1445934 , 113715", front_page," Apr 25, 1862",0362-4331, English, English, 1," New York, N.Y.","Apr 25, 1862",New York Times (1857-1922),1862,http://search.proquest.com/docview/91646181?accountid=13567, 1,http://openurl.lib.rochester.edu/find?ctx_ver=Z39.88-2004&amp;ctx_enc=info:ofi/enc:UTF-8&amp;rfr_id=info:sid/ProQ%3Ahnpnewyorktimeswindex&amp;rft_val_fmt=info:ofi/fmt:kev:mtx:journal&amp;rft.genre=unknown&amp;rft.jtitle=New+York+Times+%281857-1922%29&amp;rft.atitle=IMPORTANT+FROM+NEW-ORLEANS%2C%3A+THE+REBEL+DEFENCES+ON+THE+MISSISSIPPI+MUCH+EXAGGERATED+AN+EASY+VICTORY+PROBABLE.&amp;rft.au=&amp;rft.aulast=&amp;rft.aufirst=&amp;rft.date=1862-04-25&amp;rft.volume=&amp;rft.issue=&amp;rft.spage=1&amp;rft.isbn=&amp;rft.btitle=&amp;rft.title=New+York+Times+%281857-1922%29&amp;rft.issn=03624331,ProQuest Historical Newspapers: The New York Times (1851-2009) with Index (1851-1993)
IMPORTANT FROM THE SOUTH.,"A copy of the Richmond Examiner of the 22d inst., having fallen into my hands, 1 glean from it the following extracts:",91650222,Historical Newspapers,," Copyright New York Times Company Apr 25, 1862"," 78686568-1 , 1445934 , 113715", front_page," Apr 25, 1862",0362-4331, English, English, 1," New York, N.Y.","Apr 25, 1862",New York Times (1857-1922),1862,http://search.proquest.com/docview/91650222?accountid=13567, 1,http://openurl.lib.rochester.edu/find?ctx_ver=Z39.88-2004&amp;ctx_enc=info:ofi/enc:UTF-8&amp;rfr_id=info:sid/ProQ%3Ahnpnewyorktimeswindex&amp;rft_val_fmt=info:ofi/fmt:kev:mtx:journal&amp;rft.genre=unknown&amp;rft.jtitle=New+York+Times+%281857-1922%29&amp;rft.atitle=IMPORTANT+FROM+THE+SOUTH.%3A+REBEL+NEWS+FROM+TENNESSEE+AND+NORTH+ALABAMA.+FEARS+FOR+THE+SITUATION+THERE.+REPORTS+OF+OPERATIONS+ON+THE+YORKTOWN+PENINSULA.+ADMISSIONS+OF+ADVANTAGES+GAINED+BY+THE+NATIONAL+FORCES.+AN+ADVANCE+FROM+FREDERICKSBURGH+APPREHENDED.+PROGRESS+OF+OPERATIONS+AGAINTS+NEW-ORLEANS.+CRITICAL+SITUATION+IN+TENNESSEE+AND+NORTH+ALABAMA.+FROM+THE+PENINSULA+THE+SITUATION+IN+VIRGINIA.+BOMBARDMENT+OF+THE+FORTS+BELOW+NEW-ORLEANS.+THE+BATTLE+NEAR+CORINTH.+SLAUGHTER+OF+OFFICIAL+APPOINTMENTS.+CANNON+MAKING+IN+THE+CONFEDERATE+STATES.+NASHVILLE+REPORTED+TO+BE+RETAKEN.&amp;rft.au=&amp;rft.aulast=&amp;rft.aufirst=&amp;rft.date=1862-04-25&amp;rft.volume=&amp;rft.issue=&amp;rft.spage=1&amp;rft.isbn=&amp;rft.btitle=&amp;rft.title=New+York+Times+%281857-1922%29&amp;rft.issn=03624331,ProQuest Historical Newspapers: The New York Times (1851-2009) with Index (1851-1993)
PRESENT DEFENCES OF NEW-ORLEANS.,"The military situation at the mouth of the Mississippi becomes daily more and more intensely inter- esting. The City of New-Orleans is virtually besieged by land, lake, and river; and as we hear of the fall of one fort, and the assault upon another, our anxiety increases for the news that the metropolis of the South is once again under the flag of the Union.",91773005,Historical Newspapers,," Copyright New York Times Company Apr 21, 1862"," 82012363-1 , 1470587 , 113715", article," Apr 21, 1862",0362-4331, English, English, 8," New York, N.Y.","Apr 21, 1862",New York Times (1857-1922),1862,http://search.proquest.com/docview/91773005?accountid=13567, 8,http://openurl.lib.rochester.edu/find?ctx_ver=Z39.88-2004&amp;ctx_enc=info:ofi/enc:UTF-8&amp;rfr_id=info:sid/ProQ%3Ahnpnewyorktimeswindex&amp;rft_val_fmt=info:ofi/fmt:kev:mtx:journal&amp;rft.genre=article&amp;rft.jtitle=New+York+Times+%281857-1922%29&amp;rft.atitle=PRESENT+DEFENCES+OF+NEW-ORLEANS.%3A+THE+FACTS+AS+SUBMITTED+TO+THE+WAR+AND+NAVY+DEPARTMENTS.+TOPOGRAPHY+OF+THE+CITY-EASE+OF+SUBMERGING+IT--THE+DEFENCES+OF+THE+RIGOLETS%2C+FORTS+PIKE+AND+WOOD--THE+REBEL+GUNBOATS+ON+THE+LAKE--PLAN+OF+ISOLATING+THE+CITY--DEFENCES+ON+THE+RIVER%2C+FORTS+JACKSON+AND+ST%2C+PHILIP--REBEL+GUNBOATS+AND+RAMS+ON+THE+RIVER--COM.+PORTER%27S+PLAN+OF+DEALING+WITH+THE+GREAT+REBEL+CHAIN--THE+CITY+AT+OUR+MERCY--PROBABILITY+OF+ITS+SURRENDER.&amp;rft.au=&amp;rft.aulast=&amp;rft.aufirst=&amp;rft.date=1862-04-21&amp;rft.volume=&amp;rft.issue=&amp;rft.spage=8&amp;rft.isbn=&amp;rft.btitle=&amp;rft.title=New+York+Times+%281857-1922%29&amp;rft.issn=03624331,ProQuest Historical Newspapers: The New York Times (1851-2009) with Index (1851-1993)
THE LATEST,Official information from New Orleans states it an attack on Forts Jackson and Phillippe. . . yesterday.,1415537373,Historical Newspapers,," Copyright The Globe & Mail division of Bell Globemedia Publishing Inc. Apr 18, 1862"," 2513205422 , 26342553 , 173739", article," Apr 18, 1862",0839-3680, English, English,," Toronto, Ont.","Apr 18, 1862",The Globe (1844-1936),1862,http://search.proquest.com/docview/1415537373?accountid=13567, 2,http://openurl.lib.rochester.edu/find?ctx_ver=Z39.88-2004&amp;ctx_enc=info:ofi/enc:UTF-8&amp;rfr_id=info:sid/ProQ%3Ahnpglobeandmail&amp;rft_val_fmt=info:ofi/fmt:kev:mtx:journal&amp;rft.genre=article&amp;rft.jtitle=The+Globe+%281844-1936%29&amp;rft.atitle=THE+LATEST%3A+THE+MID-NIGHT+REPORT&amp;rft.au=&amp;rft.aulast=&amp;rft.aufirst=&amp;rft.date=1862-04-18&amp;rft.volume=&amp;rft.issue=&amp;rft.spage=2&amp;rft.isbn=&amp;rft.btitle=&amp;rft.title=The+Globe+%281844-1936%29&amp;rft.issn=08393680,ProQuest Historical Newspapers: The Globe and Mail (1844-2009)
NAVAL OPERATIONS IN THE GULF,"Official information from New-Orleans states that an attack on Forts Jackson and Philip commenced yesterday, 14th inst.",570635567,Historical Newspapers,," Copyright IHT Corporation Apr 18, 1862"," 1434537522 , 23783858 , 73093", article," Apr 18, 1862",, English, English,," New York, N.Y.","Apr 18, 1862",New - York Daily Tribune (1842-1866),1862,http://search.proquest.com/docview/570635567?accountid=13567, 12,http://openurl.lib.rochester.edu/find?ctx_ver=Z39.88-2004&amp;ctx_enc=info:ofi/enc:UTF-8&amp;rfr_id=info:sid/ProQ%3Ahnpnewyorktribunefull&amp;rft_val_fmt=info:ofi/fmt:kev:mtx:journal&amp;rft.genre=article&amp;rft.jtitle=New+-+York+Daily+Tribune+%281842-1866%29&amp;rft.atitle=NAVAL+OPERATIONS+IN+THE+GULF%3A+FORTS+JACKSON+AND+PHILIP+ASSAILED+JACKSONVILLE+EVACUATED+CONFEDERATES+IN+POSSESSION+PASSAGE+OF+THE+CONSCRIPTION+BILL+ARRIVAL+OF+THE+FRENCH+MINISTER+AT+NORFOLK+THE+ATTACK+ON+NEW-ORLEANS+TEN+UNION+MORTAR+BOATS+PASS+FORTS+JACKSON+AND+ST.+PHILIP%2C+ON+THE+MISSISSIPPI+RIVER--CONDITION+OF+AFFAIRS+AT+PENSACOLA%2C+%26C.+ATTACK+ON+FORTS+JACKSON+AND+ST.+PHILIP+BY+PORTER%27S+MORTAR+FLEET&amp;rft.au=&amp;rft.aulast=&amp;rft.aufirst=&amp;rft.date=1862-04-18&amp;rft.volume=&amp;rft.issue=&amp;rft.spage=12&amp;rft.isbn=&amp;rft.btitle=&amp;rft.title=New+-+York+Daily+Tribune+%281842-1866%29&amp;rft.issn=,ProQuest Historical Newspapers: New York Tribune / Herald Tribune  (1841-1962)
