Title,Abstract,StoreId,ArticleType,Authors,copyright,digitalObjectIdentifier,documentType,entryDate,issn,language,languageOfSummary,pages,placeOfPublication,pubdate,pubtitle,year,DocumentURL,startPage,FindACopy,Database
THE REBELLION.,"In three separate bulletins, admirable for their brevity and distinctness, the Secretary of War sums up the whole of the news from the armies East and West, which had reached the Department up to yesterday afternoon. The dispatches from Gen. GRANT come up to Friday evening at 6 o'clock. During that day the advance of HAN",91838013,Historical Newspapers,," Copyright New York Times Company May 15, 1864"," 80294864-1 , 1459055 , 113715", article," May 15, 1864",0362-4331, English, English, 4," New York, N.Y.","May 15, 1864",New York Times (1857-1922),1864,http://search.proquest.com/docview/91838013?accountid=13567, 4,http://openurl.lib.rochester.edu/find?ctx_ver=Z39.88-2004&amp;ctx_enc=info:ofi/enc:UTF-8&amp;rfr_id=info:sid/ProQ%3Ahnpnewyorktimeswindex&amp;rft_val_fmt=info:ofi/fmt:kev:mtx:journal&amp;rft.genre=article&amp;rft.jtitle=New+York+Times+%281857-1922%29&amp;rft.atitle=THE+REBELLION.&amp;rft.au=&amp;rft.aulast=&amp;rft.aufirst=&amp;rft.date=1864-05-15&amp;rft.volume=&amp;rft.issue=&amp;rft.spage=4&amp;rft.isbn=&amp;rft.btitle=&amp;rft.title=New+York+Times+%281857-1922%29&amp;rft.issn=03624331,ProQuest Historical Newspapers: The New York Times (1851-2009) with Index (1851-1993)
SPECIAL DISPATCHES TO THE N.Y. TIMES.,"The four hours that have passed since the date of my last dispatch have been occupied with vigorous hammer-and-tongs work that does not appear to have greatly advanced the upshot of the contest, save in the destruction of life to the enemy that may have been accomplished.",91814090,Historical Newspapers,," Copyright New York Times Company May 14, 1864"," 78724243 , 1446315 , 113715", front_page," May 14, 1864",0362-4331, English, English, 1," New York, N.Y.","May 14, 1864",New York Times (1857-1922),1864,http://search.proquest.com/docview/91814090?accountid=13567, 1,http://openurl.lib.rochester.edu/find?ctx_ver=Z39.88-2004&amp;ctx_enc=info:ofi/enc:UTF-8&amp;rfr_id=info:sid/ProQ%3Ahnpnewyorktimeswindex&amp;rft_val_fmt=info:ofi/fmt:kev:mtx:journal&amp;rft.genre=unknown&amp;rft.jtitle=New+York+Times+%281857-1922%29&amp;rft.atitle=SPECIAL+DISPATCHES+TO+THE+N.Y.+TIMES.%3A+THURSDAY.+FULL+DETAILS+OF+THE+GREAT+BATTLE.&amp;rft.au=&amp;rft.aulast=&amp;rft.aufirst=&amp;rft.date=1864-05-14&amp;rft.volume=&amp;rft.issue=&amp;rft.spage=1&amp;rft.isbn=&amp;rft.btitle=&amp;rft.title=New+York+Times+%281857-1922%29&amp;rft.issn=03624331,ProQuest Historical Newspapers: The New York Times (1851-2009) with Index (1851-1993)
THE GREAT CAMPAIGN.,"Maj.-Gen. Dix: Official dispatches just received by this Department dated yesterday, 8 A.M. at the battle-field, near Spottsylvania Court-House. They state that during the night, Gen. HANCOCK marched frown his previous position on our right and occupied the ground between Gens.",91844695,Historical Newspapers,," Copyright New York Times Company May 14, 1864"," 78724242-1 , 1446315 , 113715", front_page," May 14, 1864",0362-4331, English, English, 1," New York, N.Y.","May 14, 1864",New York Times (1857-1922),1864,http://search.proquest.com/docview/91844695?accountid=13567, 1,http://openurl.lib.rochester.edu/find?ctx_ver=Z39.88-2004&amp;ctx_enc=info:ofi/enc:UTF-8&amp;rfr_id=info:sid/ProQ%3Ahnpnewyorktimeswindex&amp;rft_val_fmt=info:ofi/fmt:kev:mtx:journal&amp;rft.genre=unknown&amp;rft.jtitle=New+York+Times+%281857-1922%29&amp;rft.atitle=THE+GREAT+CAMPAIGN.%3A+GEN.+GRANT%27S+DECISIVE+BATTLE.LEE%27S+ARMY+IN+FULL+RETREAT.+OUR+ARMY+IN+PURSUIT+THE+GLORIOUS+WORK+OF+THURSDAY.+GRANT+FINDS+THE+REBELS+IN+THE+LAST+DITCH.+GREAT+CAPTURES+OF+PRISONERS+AND+ARTILLERY.THE+TROPHIES+OF+VICTORY+A+WHOLE+REBEL+DIVISION+AND+THIRTY+GUNS.REINFORCEMENTS+PRESSING+FORWARD+HIGHLY+IMPORTANT+FROM+GEN.+SIGEL.COMMUNICATION+WITH+LYNCHBURGH+SEVERED.THE+OPERATIONS+OF+GEN.+BUTLER.HIS+ARMY+MOVING+ON+FORT+DARLING.+THE+CONDITION+OF+THE+WOUNDED+AT+WASHINGTON.FULL+DETAILS+FROM+OUR+SPECIAL+CORRESPONDENTS.DISPATCHES+FROM+THE+WAR+OFFICE.+FIRST+DISPATCH.+SECOND+DISPATCH.+%5BOFFICIAL.%5D+THIRD+DISPATCH.+FOURTH+DISPATCH.+%5BOFFICIAL.%5D&amp;rft.au=&amp;rft.aulast=&amp;rft.aufirst=&amp;rft.date=1864-05-14&amp;rft.volume=&amp;rft.issue=&amp;rft.spage=1&amp;rft.isbn=&amp;rft.btitle=&amp;rft.title=New+York+Times+%281857-1922%29&amp;rft.issn=03624331,ProQuest Historical Newspapers: The New York Times (1851-2009) with Index (1851-1993)
LATEST FROM THE BATTLE-FIELD,,91813934,Historical Newspapers,," Copyright New York Times Company May 14, 1864"," 78724333 , 1446315 , 113715", article," May 14, 1864",0362-4331, English, English, 8," New York, N.Y.","May 14, 1864",New York Times (1857-1922),1864,http://search.proquest.com/docview/91813934?accountid=13567, 8,http://openurl.lib.rochester.edu/find?ctx_ver=Z39.88-2004&amp;ctx_enc=info:ofi/enc:UTF-8&amp;rfr_id=info:sid/ProQ%3Ahnpnewyorktimeswindex&amp;rft_val_fmt=info:ofi/fmt:kev:mtx:journal&amp;rft.genre=article&amp;rft.jtitle=New+York+Times+%281857-1922%29&amp;rft.atitle=LATEST+FROM+THE+BATTLE-FIELD&amp;rft.au=&amp;rft.aulast=&amp;rft.aufirst=&amp;rft.date=1864-05-14&amp;rft.volume=&amp;rft.issue=&amp;rft.spage=8&amp;rft.isbn=&amp;rft.btitle=&amp;rft.title=New+York+Times+%281857-1922%29&amp;rft.issn=03624331,ProQuest Historical Newspapers: The New York Times (1851-2009) with Index (1851-1993)
ANOTHER DISPATCH.,"A letter just received from an officer on a distinguished General's staff, dated on the battle-field at 8 o'clock last night, says:",91820695,Historical Newspapers,," Copyright New York Times Company May 14, 1864"," 78724334 , 1446315 , 113715", article," May 14, 1864",0362-4331, English, English, 8," New York, N.Y.","May 14, 1864",New York Times (1857-1922),1864,http://search.proquest.com/docview/91820695?accountid=13567, 8,http://openurl.lib.rochester.edu/find?ctx_ver=Z39.88-2004&amp;ctx_enc=info:ofi/enc:UTF-8&amp;rfr_id=info:sid/ProQ%3Ahnpnewyorktimeswindex&amp;rft_val_fmt=info:ofi/fmt:kev:mtx:journal&amp;rft.genre=article&amp;rft.jtitle=New+York+Times+%281857-1922%29&amp;rft.atitle=ANOTHER+DISPATCH.&amp;rft.au=&amp;rft.aulast=&amp;rft.aufirst=&amp;rft.date=1864-05-14&amp;rft.volume=&amp;rft.issue=&amp;rft.spage=8&amp;rft.isbn=&amp;rft.btitle=&amp;rft.title=New+York+Times+%281857-1922%29&amp;rft.issn=03624331,ProQuest Historical Newspapers: The New York Times (1851-2009) with Index (1851-1993)
"THE BATTLE OF SUNDAY, MAY 8.","I have this morning returned from our advanced line of battle, which lies within two and a half miles of Spottsylvania Court-house, the enemy confronting in force.",91816206,Historical Newspapers,," Copyright New York Times Company May 13, 1864"," 78724101 , 1446314 , 113715", front_page," May 13, 1864",0362-4331, English, English, 1," New York, N.Y.","May 13, 1864",New York Times (1857-1922),1864,http://search.proquest.com/docview/91816206?accountid=13567, 1,http://openurl.lib.rochester.edu/find?ctx_ver=Z39.88-2004&amp;ctx_enc=info:ofi/enc:UTF-8&amp;rfr_id=info:sid/ProQ%3Ahnpnewyorktimeswindex&amp;rft_val_fmt=info:ofi/fmt:kev:mtx:journal&amp;rft.genre=unknown&amp;rft.jtitle=New+York+Times+%281857-1922%29&amp;rft.atitle=THE+BATTLE+OF+SUNDAY%2C+MAY+8.&amp;rft.au=&amp;rft.aulast=&amp;rft.aufirst=&amp;rft.date=1864-05-13&amp;rft.volume=&amp;rft.issue=&amp;rft.spage=1&amp;rft.isbn=&amp;rft.btitle=&amp;rft.title=New+York+Times+%281857-1922%29&amp;rft.issn=03624331,ProQuest Historical Newspapers: The New York Times (1851-2009) with Index (1851-1993)
"SKIRMISHES OF MONDAY, MAY 9.","The military situation at this hour (Tuesday, 12 M.) finds the line of the army drawn around Spottsylvania Court-house in the arc of a circle, the concave toward us.",91807350,Historical Newspapers,," Copyright New York Times Company May 13, 1864"," 78724102 , 1446314 , 113715", front_page," May 13, 1864",0362-4331, English, English, 1," New York, N.Y.","May 13, 1864",New York Times (1857-1922),1864,http://search.proquest.com/docview/91807350?accountid=13567, 1,http://openurl.lib.rochester.edu/find?ctx_ver=Z39.88-2004&amp;ctx_enc=info:ofi/enc:UTF-8&amp;rfr_id=info:sid/ProQ%3Ahnpnewyorktimeswindex&amp;rft_val_fmt=info:ofi/fmt:kev:mtx:journal&amp;rft.genre=unknown&amp;rft.jtitle=New+York+Times+%281857-1922%29&amp;rft.atitle=SKIRMISHES+OF+MONDAY%2C+MAY+9.%3A+%5BIN+ORDER+TO+MAKE+OUR+ACCOUNT+CONTINUOUS+FROM+DAY+TO+DAY%2C+WE+INSERT+AGAIN+A+PART+OF+A+LETTER+GIVEN+YESTERDAY.%5D&amp;rft.au=&amp;rft.aulast=&amp;rft.aufirst=&amp;rft.date=1864-05-13&amp;rft.volume=&amp;rft.issue=&amp;rft.spage=1&amp;rft.isbn=&amp;rft.btitle=&amp;rft.title=New+York+Times+%281857-1922%29&amp;rft.issn=03624331,ProQuest Historical Newspapers: The New York Times (1851-2009) with Index (1851-1993)
REPORTS FROM WASHINGTON.,"Yesterday morning the fighting was again renewed, and was continued with various success until about 11 o'clock, when our line was somewhat advanced.",91816575,Historical Newspapers,," Copyright New York Times Company May 13, 1864"," 78724212 , 1446314 , 113715", article," May 13, 1864",0362-4331, English, English, 8," New York, N.Y.","May 13, 1864",New York Times (1857-1922),1864,http://search.proquest.com/docview/91816575?accountid=13567, 8,http://openurl.lib.rochester.edu/find?ctx_ver=Z39.88-2004&amp;ctx_enc=info:ofi/enc:UTF-8&amp;rfr_id=info:sid/ProQ%3Ahnpnewyorktimeswindex&amp;rft_val_fmt=info:ofi/fmt:kev:mtx:journal&amp;rft.genre=article&amp;rft.jtitle=New+York+Times+%281857-1922%29&amp;rft.atitle=REPORTS+FROM+WASHINGTON.%3A+THE+FIGHTING+RENEWED+ON+WEDNESDAY+OUR+LINES+ADVANCE+A+FLAG+OF+TRUCE+FROM+GEN.+LEE+WANTS+TIME+TO+BURY+HIS+DEAD+GRANT+SAYS+HE+HASN%27T+TIME+TO+BURY+HIS+OWN+DEAD%2C+AND+PROPOSES+TO+ADVANCE+LEE+WITHDRAWS+HIS+CENTRE+EVIDENCES+OF+A+RETREAT+OVER+FOUR+THOUSAND+PRISONERS+CAPTURED+ON+TUESDAY+AND+WEDNESDAY+THE+LOSSES.+THE+DESPERATE+FIGHTING+OF+TUESDAY+THE+CHARGE+OF+THE+SIXTH+CORPS+THE+BATTLE+PROBABLY+RENEWED+WEDNESDAY+DEATH+OF+GENS.+RICH+AND+STEVENSON+INCIDENTS+OF+THE+BATTLE.+HILL+REPULSED+BY+BURNSIDE+GALLANT+CONDUCT+OF+THE+COLORED+TROOPS+EVERYTHING+LOOKING+HOPEFUL+SIGEL+BELIEVED+TO+HAVEREACHED+LYNCHBURGH.&amp;rft.au=&amp;rft.aulast=&amp;rft.aufirst=&amp;rft.date=1864-05-13&amp;rft.volume=&amp;rft.issue=&amp;rft.spage=8&amp;rft.isbn=&amp;rft.btitle=&amp;rft.title=New+York+Times+%281857-1922%29&amp;rft.issn=03624331,ProQuest Historical Newspapers: The New York Times (1851-2009) with Index (1851-1993)
VICTORY!,News received to-day continues to be of a most satisfactory character.,91807762,Historical Newspapers,," Copyright New York Times Company May 13, 1864"," 78724211 , 1446314 , 113715", article," May 13, 1864",0362-4331, English, English, 8," New York, N.Y.","May 13, 1864",New York Times (1857-1922),1864,http://search.proquest.com/docview/91807762?accountid=13567, 8,http://openurl.lib.rochester.edu/find?ctx_ver=Z39.88-2004&amp;ctx_enc=info:ofi/enc:UTF-8&amp;rfr_id=info:sid/ProQ%3Ahnpnewyorktimeswindex&amp;rft_val_fmt=info:ofi/fmt:kev:mtx:journal&amp;rft.genre=article&amp;rft.jtitle=New+York+Times+%281857-1922%29&amp;rft.atitle=VICTORY%21%3A+A+DECISIVE+BATTLE.+LEE%27S+ARMY+ROUTED.+A+TERRIFIC+CHARGE+BY+GENERAL+HANCOCK.+DESPERATE+FURY+OF+OUR+MEN.+THREE+GENERALS%2C+50+OFFICERS%2C+3%2C000+MEN+AND+12+GUNS+CAPTURED.+SPLENDID+NEWS+FROM+GENERAL+SHERIDAN.+LEE%27S+COMMUNICATIONS+TOTALLY+SEVERED.+TRAINS+AND+SUPPLIES+CAPTURED.+OVER+FIVE+HUNDRED+UNION+PRISONERS+RETAKEN.+DISPATCHES+FROM+THE+WAR+OFFICE+FIRST+DISPATCH.+%5BOFFICIAL.%5D+SECOND+DISPATCH+%5BOFFICIAL.%5D&amp;rft.au=&amp;rft.aulast=&amp;rft.aufirst=&amp;rft.date=1864-05-13&amp;rft.volume=&amp;rft.issue=&amp;rft.spage=8&amp;rft.isbn=&amp;rft.btitle=&amp;rft.title=New+York+Times+%281857-1922%29&amp;rft.issn=03624331,ProQuest Historical Newspapers: The New York Times (1851-2009) with Index (1851-1993)
Operations of Gen. Robinson's Division The Bodies of Dead and Wounded Consumed by Fire A Night's Fight with the Fifth Corps A Terrible Reception of the Enemy.,"Gen. ROBINSON suffers much from his wound, which is in the knee. His division was in the advance on the Spottsylvania road, from Todd's Tavern, with Gen. PHIL. SHERIDAN'S cavalry, and had driven the rebels about six miles, carrying two positions they had endeavored to hold on to.",91825440,Historical Newspapers,," Copyright New York Times Company May 12, 1864"," 78723979 , 1446313 , 113715", front_page," May 12, 1864",0362-4331, English, English, 1," New York, N.Y.","May 12, 1864",New York Times (1857-1922),1864,http://search.proquest.com/docview/91825440?accountid=13567, 1,http://openurl.lib.rochester.edu/find?ctx_ver=Z39.88-2004&amp;ctx_enc=info:ofi/enc:UTF-8&amp;rfr_id=info:sid/ProQ%3Ahnpnewyorktimeswindex&amp;rft_val_fmt=info:ofi/fmt:kev:mtx:journal&amp;rft.genre=unknown&amp;rft.jtitle=New+York+Times+%281857-1922%29&amp;rft.atitle=Operations+of+Gen.+Robinson%27s+Division+The+Bodies+of+Dead+and+Wounded+Consumed+by+Fire+A+Night%27s+Fight+with+the+Fifth+Corps+A+Terrible+Reception+of+the+Enemy.%3A+THIRD+DISPATCH.&amp;rft.au=&amp;rft.aulast=&amp;rft.aufirst=&amp;rft.date=1864-05-12&amp;rft.volume=&amp;rft.issue=&amp;rft.spage=1&amp;rft.isbn=&amp;rft.btitle=&amp;rft.title=New+York+Times+%281857-1922%29&amp;rft.issn=03624331,ProQuest Historical Newspapers: The New York Times (1851-2009) with Index (1851-1993)
SPECIAL DISPATCHES TO THE N.Y. TIMES,"The latest news received here from Gen GRANT'S army relates to the operations of Monday and yesterday. The fight on Monday evening was very severe, inflicting a loss on our side of over two thousand men killed and wounded. It was brought on by HANCOCK, who, in his effort to take Spottsylvania Court-house, accomplished the crossing of the River Po under cover of a tremendous artillery fire, and established himself on the south bank.",91814527,Historical Newspapers,," Copyright New York Times Company May 12, 1864"," 78723973 , 1446313 , 113715", front_page," May 12, 1864",0362-4331, English, English, 1," New York, N.Y.","May 12, 1864",New York Times (1857-1922),1864,http://search.proquest.com/docview/91814527?accountid=13567, 1,http://openurl.lib.rochester.edu/find?ctx_ver=Z39.88-2004&amp;ctx_enc=info:ofi/enc:UTF-8&amp;rfr_id=info:sid/ProQ%3Ahnpnewyorktimeswindex&amp;rft_val_fmt=info:ofi/fmt:kev:mtx:journal&amp;rft.genre=unknown&amp;rft.jtitle=New+York+Times+%281857-1922%29&amp;rft.atitle=SPECIAL+DISPATCHES+TO+THE+N.Y.+TIMES%3A+THE+BATTLE+OF+MONDAY+EVENING+HANCOCK+CROSSES+THE+RIVER+PO+LEE%27S+POSITION+AND+LINE+OF+BATTLE+SIGNS+OF+DESPONDENCY+ON+THE+PART+OF+THE+REBELS+NO+SIGNS+OF+WEARINESS+IN+GRANT%27S+ARMY+LEE+OUT+OF+RATIONS+SIX+THOUSAND+PRISONERS+CAPTURED.&amp;rft.au=&amp;rft.aulast=&amp;rft.aufirst=&amp;rft.date=1864-05-12&amp;rft.volume=&amp;rft.issue=&amp;rft.spage=1&amp;rft.isbn=&amp;rft.btitle=&amp;rft.title=New+York+Times+%281857-1922%29&amp;rft.issn=03624331,ProQuest Historical Newspapers: The New York Times (1851-2009) with Index (1851-1993)
THE GREAT CAMPAIGN.,"Dispatches from the Army of the Potomac have just reached here, bearing dates to 5 o'clock P.M., of yesterday. Both armies at that time held their positions at Spottsylvania Court-house, without any material change.",91815523,Historical Newspapers," Major-Gen. Dix:
Major-Gen. Dix:"," Copyright New York Times Company May 12, 1864"," 78723971-1 , 1446313 , 113715", front_page," May 12, 1864",0362-4331, English, English, 1," New York, N.Y.","May 12, 1864",New York Times (1857-1922),1864,http://search.proquest.com/docview/91815523?accountid=13567, 1,http://openurl.lib.rochester.edu/find?ctx_ver=Z39.88-2004&amp;ctx_enc=info:ofi/enc:UTF-8&amp;rfr_id=info:sid/ProQ%3Ahnpnewyorktimeswindex&amp;rft_val_fmt=info:ofi/fmt:kev:mtx:journal&amp;rft.genre=unknown&amp;rft.jtitle=New+York+Times+%281857-1922%29&amp;rft.atitle=THE+GREAT+CAMPAIGN.%3A+ANOTHER+TERRIFIC+BATTLE%2C+ANOTHER+DEFEAT+OF+THE+REBELS.+THE+REBEL+RIGHT+CRUSHED.+THREE+BRIGADES+AND+FOUR+GUNS+CAPTURED.+THE+REBEL+INTRENCHMENTS+OCCUPIED.+THE+BATTLE+NOT+RENEWED+YESTERDAY+AUTHENTIC+DETAILS+TO+WEDNESDAY+AT+10+O%27CLOCK.+HANCOCK+CROSSES+THE+RIVER+PO.+THE+REBEL+ARMY+BECOMING+DISHEARTENED.+SIX+THOUSAND+PRISONERS+CAPTURED.+DEATH+OF+BRIGADIER-GENERAL+STEVENSON%2C+OF+MASSACHUSETTS.+CONTINUED+SUCCESS+OF+GEN.+BUTLER.+LATER+INTELLIGENCE+FROM+GENERAL+SHERMAN.+RELIABLE+DETAILS+FROM+THE+WAR+OFFICE+AND+OUR+SPECIAL+CORRESPONDENTS.+DISPATCHES+FROM+THE+WAR+OFFICE.+ADVICES+FROM+GEN.+GRANT+TO+TUESDAY+AT+FIVE+O%27CLOCK+THE+ENEMY+DRIVEN+TO+THEIR+BREASTWORKS+THEIR+FIRST+LINE+OF+RIFLE+PITS+CARRIED-THE+WOUNDED.&amp;rft.au=Major-Gen.+Dix%3A&amp;rft.aulast=Major-Gen.+Dix%3A&amp;rft.aufirst=&amp;rft.date=1864-05-12&amp;rft.volume=&amp;rft.issue=&amp;rft.spage=1&amp;rft.isbn=&amp;rft.btitle=&amp;rft.title=New+York+Times+%281857-1922%29&amp;rft.issn=03624331,ProQuest Historical Newspapers: The New York Times (1851-2009) with Index (1851-1993)
VERY LATEST.,"A distinguished officer arrived here about 10 o'clock to-night who was present during the terrible conflict of yesterday afternoon and last evening, and who left Gen. GRANT in the saddle as late as ten o'clock this morning. He sums up the bloody work of yesterday thus:",91837048,Historical Newspapers,," Copyright New York Times Company May 12, 1864"," 78724073 , 1446313 , 113715", article," May 12, 1864",0362-4331, English, English, 8," New York, N.Y.","May 12, 1864",New York Times (1857-1922),1864,http://search.proquest.com/docview/91837048?accountid=13567, 8,http://openurl.lib.rochester.edu/find?ctx_ver=Z39.88-2004&amp;ctx_enc=info:ofi/enc:UTF-8&amp;rfr_id=info:sid/ProQ%3Ahnpnewyorktimeswindex&amp;rft_val_fmt=info:ofi/fmt:kev:mtx:journal&amp;rft.genre=article&amp;rft.jtitle=New+York+Times+%281857-1922%29&amp;rft.atitle=VERY+LATEST.%3A+ANOTHER+TERRIBLE+BATTLE+ON+TUESDAY.+ADVICES+UP+TO+WEDNESDAY+MORNING+AT+10+O%27CLOCK.+WASHINGTON%2C+WEDNESDAY%2C+MAY+11.&amp;rft.au=&amp;rft.aulast=&amp;rft.aufirst=&amp;rft.date=1864-05-12&amp;rft.volume=&amp;rft.issue=&amp;rft.spage=8&amp;rft.isbn=&amp;rft.btitle=&amp;rft.title=New+York+Times+%281857-1922%29&amp;rft.issn=03624331,ProQuest Historical Newspapers: The New York Times (1851-2009) with Index (1851-1993)
GRANT'S ADVANCE.,To Maj.-Gen Dix: Dispatches have been received this evening from Lieut.-Gen. GRANT dated at 1 o'clock yesterday.,91823522,Historical Newspapers,," Copyright New York Times Company May 11, 1864"," 78723883 , 1446312 , 113715", front_page," May 11, 1864",0362-4331, English, English, 1," New York, N.Y.","May 11, 1864",New York Times (1857-1922),1864,http://search.proquest.com/docview/91823522?accountid=13567, 1,http://openurl.lib.rochester.edu/find?ctx_ver=Z39.88-2004&amp;ctx_enc=info:ofi/enc:UTF-8&amp;rfr_id=info:sid/ProQ%3Ahnpnewyorktimeswindex&amp;rft_val_fmt=info:ofi/fmt:kev:mtx:journal&amp;rft.genre=unknown&amp;rft.jtitle=New+York+Times+%281857-1922%29&amp;rft.atitle=GRANT%27S+ADVANCE.%3A+OFFICIAL+DISPATCHES+TO+SUNDAY+NOON.+THE+REBELS+MAKE+A+STAND+AT+SPOTTSYLVANIA.+SOME+HARD+FIGHTING%2C+BUT+NO+GENERAL+ENGAGEMENT.+DEATH+OF+GENERAL+SEDGWICK.+THE+BATTLE+PROBABLY+RENEWED+YESTERDAY.+THE+ARMY+REPLENISHING+SUPPLIES+FOR+A+RAPID+MARCH.+VERY+IMPORTANT+FROM+GENERAL+BUTLER.+A+SEVERE+BATTLE+ON+MONDAY.+THE+PETERSBURGH+RAILROAD+IN+OUR+POSSESSION.+BEAUREGARD+DEFEATED+AND+HIS+FORCES+DIVIDED.+IMPORTANT+FROM+SHERMAN+A+GREAT+BATTLE+GOING+ON+NEAR+DALTON.+FROM+GEN.+SHERMAN%27S+ARMY+IMPORTANT+PROGRESS+A+GREAT+BATTLE+PROBABLY+IN+PROGRESS.+FROM+GEN.+BUTLER%27S+ARMY+BEAUREGARD+DEFEATED+HIS+FORCES+DIVIDED+THE+RAILROADCUT+NORTH+AND+SOUTH+OF+PETERSBURGH+ASEVERE+BATTLE+ON+SUNDAY+MANY+PRISONERS+CAPTURED.&amp;rft.au=&amp;rft.aulast=&amp;rft.aufirst=&amp;rft.date=1864-05-11&amp;rft.volume=&amp;rft.issue=&amp;rft.spage=1&amp;rft.isbn=&amp;rft.btitle=&amp;rft.title=New+York+Times+%281857-1922%29&amp;rft.issn=03624331,ProQuest Historical Newspapers: The New York Times (1851-2009) with Index (1851-1993)
RICHMOND AND THE REBELLION.,mond papers of Friday last express great fear for the safety of that city. The Whig seems to think there is not only danger im- pending over the rebel captial but over the,91830474,Historical Newspapers,," Copyright New York Times Company May 11, 1864"," 78723927 , 1446312 , 113715", article," May 11, 1864",0362-4331, English, English, 4," New York, N.Y.","May 11, 1864",New York Times (1857-1922),1864,http://search.proquest.com/docview/91830474?accountid=13567, 4,http://openurl.lib.rochester.edu/find?ctx_ver=Z39.88-2004&amp;ctx_enc=info:ofi/enc:UTF-8&amp;rfr_id=info:sid/ProQ%3Ahnpnewyorktimeswindex&amp;rft_val_fmt=info:ofi/fmt:kev:mtx:journal&amp;rft.genre=article&amp;rft.jtitle=New+York+Times+%281857-1922%29&amp;rft.atitle=RICHMOND+AND+THE+REBELLION.&amp;rft.au=&amp;rft.aulast=&amp;rft.aufirst=&amp;rft.date=1864-05-11&amp;rft.volume=&amp;rft.issue=&amp;rft.spage=4&amp;rft.isbn=&amp;rft.btitle=&amp;rft.title=New+York+Times+%281857-1922%29&amp;rft.issn=03624331,ProQuest Historical Newspapers: The New York Times (1851-2009) with Index (1851-1993)
POSTSCRIPT.,"The Army of the Potomac has had a portion of a day to recuperate. Gen. BURNSIDE on Monday began the attack on the left with great fury, and with an encouraging degree of success. He had a fight the day before, in which, to use his own words, he ""whipped old LONGSTREET.""",91857270,Historical Newspapers,," Copyright New York Times Company May 11, 1864"," 78723953-1 , 1446312 , 113715", article," May 11, 1864",0362-4331, English, English, 8," New York, N.Y.","May 11, 1864",New York Times (1857-1922),1864,http://search.proquest.com/docview/91857270?accountid=13567, 8,http://openurl.lib.rochester.edu/find?ctx_ver=Z39.88-2004&amp;ctx_enc=info:ofi/enc:UTF-8&amp;rfr_id=info:sid/ProQ%3Ahnpnewyorktimeswindex&amp;rft_val_fmt=info:ofi/fmt:kev:mtx:journal&amp;rft.genre=article&amp;rft.jtitle=New+York+Times+%281857-1922%29&amp;rft.atitle=POSTSCRIPT.%3A+FROM+THE+ARMY.+THE+POSITION+OF+THE+FORCES.+THE+REBELS+OCCUPY+SPOTTSYLVANIA.+LONGSTREET%27S+CORPS+DEFEATED+BY+GEN.+BURNSIDE.+DEATH+OF+LONGSTREET.+PARTICULAR+OF+GEN.+SEDGWICK%27S+DEATH.+FURTHER+LISTS+OF+CASUALTIES.+ARRIVAL+OF+EXCHANGED+PRISONERS+RICHMOND+EXCITED.&amp;rft.au=&amp;rft.aulast=&amp;rft.aufirst=&amp;rft.date=1864-05-11&amp;rft.volume=&amp;rft.issue=&amp;rft.spage=8&amp;rft.isbn=&amp;rft.btitle=&amp;rft.title=New+York+Times+%281857-1922%29&amp;rft.issn=03624331,ProQuest Historical Newspapers: The New York Times (1851-2009) with Index (1851-1993)
DISPATCHES FROM THE WAR-OFFICE.,,91815609,Historical Newspapers,," Copyright New York Times Company May 10, 1864"," 80294705 , 1459054 , 113715", article," May 10, 1864",0362-4331, English, English, 1," New York, N.Y.","May 10, 1864",New York Times (1857-1922),1864,http://search.proquest.com/docview/91815609?accountid=13567, 1,http://openurl.lib.rochester.edu/find?ctx_ver=Z39.88-2004&amp;ctx_enc=info:ofi/enc:UTF-8&amp;rfr_id=info:sid/ProQ%3Ahnpnewyorktimeswindex&amp;rft_val_fmt=info:ofi/fmt:kev:mtx:journal&amp;rft.genre=article&amp;rft.jtitle=New+York+Times+%281857-1922%29&amp;rft.atitle=DISPATCHES+FROM+THE+WAR-OFFICE.%3A+FIRST+DISPATCH.+THE+GENERAL+RESULT+A+SUCCESS--THE+FIGHTING+DESPERATE-THE+COOL%2C+DETERMINED+COURAGE+OF+THE+ARMY--THE+DEATH+OF+GEN.WADSWORTH--GEN.+SHERMAN+HEARD+FROM.&amp;rft.au=&amp;rft.aulast=&amp;rft.aufirst=&amp;rft.date=1864-05-10&amp;rft.volume=&amp;rft.issue=&amp;rft.spage=1&amp;rft.isbn=&amp;rft.btitle=&amp;rft.title=New+York+Times+%281857-1922%29&amp;rft.issn=03624331,ProQuest Historical Newspapers: The New York Times (1851-2009) with Index (1851-1993)
THIRD DISPATCH.,,91815552,Historical Newspapers,," Copyright New York Times Company May 10, 1864"," 80294707 , 1459054 , 113715", front_page," May 10, 1864",0362-4331, English, English, 1," New York, N.Y.","May 10, 1864",New York Times (1857-1922),1864,http://search.proquest.com/docview/91815552?accountid=13567, 1,http://openurl.lib.rochester.edu/find?ctx_ver=Z39.88-2004&amp;ctx_enc=info:ofi/enc:UTF-8&amp;rfr_id=info:sid/ProQ%3Ahnpnewyorktimeswindex&amp;rft_val_fmt=info:ofi/fmt:kev:mtx:journal&amp;rft.genre=unknown&amp;rft.jtitle=New+York+Times+%281857-1922%29&amp;rft.atitle=THIRD+DISPATCH.%3A+GEN.+GRANT+%22ON+TO+RICHMOND%22+CAPTURE+OF+TWO+THOUSAND+PRISONERS.&amp;rft.au=&amp;rft.aulast=&amp;rft.aufirst=&amp;rft.date=1864-05-10&amp;rft.volume=&amp;rft.issue=&amp;rft.spage=1&amp;rft.isbn=&amp;rft.btitle=&amp;rft.title=New+York+Times+%281857-1922%29&amp;rft.issn=03624331,ProQuest Historical Newspapers: The New York Times (1851-2009) with Index (1851-1993)
Richmond and Petersburgh Not Evacuated. Gen. Hancock in Vigorous Pursuit of Lee The Casualties.,,91826594,Historical Newspapers,," Copyright New York Times Company May 10, 1864"," 80294713 , 1459054 , 113715", front_page," May 10, 1864",0362-4331, English, English, 1," New York, N.Y.","May 10, 1864",New York Times (1857-1922),1864,http://search.proquest.com/docview/91826594?accountid=13567, 1,http://openurl.lib.rochester.edu/find?ctx_ver=Z39.88-2004&amp;ctx_enc=info:ofi/enc:UTF-8&amp;rfr_id=info:sid/ProQ%3Ahnpnewyorktimeswindex&amp;rft_val_fmt=info:ofi/fmt:kev:mtx:journal&amp;rft.genre=unknown&amp;rft.jtitle=New+York+Times+%281857-1922%29&amp;rft.atitle=Richmond+and+Petersburgh+Not+Evacuated.+Gen.+Hancock+in+Vigorous+Pursuit+of+Lee+The+Casualties.&amp;rft.au=&amp;rft.aulast=&amp;rft.aufirst=&amp;rft.date=1864-05-10&amp;rft.volume=&amp;rft.issue=&amp;rft.spage=1&amp;rft.isbn=&amp;rft.btitle=&amp;rft.title=New+York+Times+%281857-1922%29&amp;rft.issn=03624331,ProQuest Historical Newspapers: The New York Times (1851-2009) with Index (1851-1993)
