Title,Abstract,StoreId,ArticleType,Authors,copyright,digitalObjectIdentifier,documentType,entryDate,issn,language,languageOfSummary,pages,placeOfPublication,pubdate,pubtitle,year,DocumentURL,startPage,FindACopy,Database
GRANT'S ARMY.,"To Maj.-Gen. Dix: A dispatch from Maj.-Gen. Banks, dated May 21, on the Mississippi River, was received to-day. It details the brilliant engineering achievement of Col. BAILEY, in constructing a dam across the falls of Red River for the relief of the gunboat fleet, the particulars of which have already been made public.",91815199,Historical Newspapers,," Copyright New York Times Company May 28, 1864"," 80295265-1 , 1459061 , 113715", front_page," May 28, 1864",0362-4331, English, English, 1," New York, N.Y.","May 28, 1864",New York Times (1857-1922),1864,http://search.proquest.com/docview/91815199?accountid=13567, 1,http://openurl.lib.rochester.edu/find?ctx_ver=Z39.88-2004&amp;ctx_enc=info:ofi/enc:UTF-8&amp;rfr_id=info:sid/ProQ%3Ahnpnewyorktimeswindex&amp;rft_val_fmt=info:ofi/fmt:kev:mtx:journal&amp;rft.genre=unknown&amp;rft.jtitle=New+York+Times+%281857-1922%29&amp;rft.atitle=GRANT%27S+ARMY.%3A+THE+ADVANCE+UPON+RICHMOND.+HOW+LEE+WAS+OUTFLANKED.+THE+REASON+WHY+IT+WAS+DONE.+HERCULEAN+FEATS+OF+MARCHING+BY+OUR+ARMY.+THE+SPIRITED+CONFLICTS+ON+THE+NORTH+ANNA.+HOW+THE+REBELS+WERE+BEATEN+AND+THE+RIVER+CROSSED.+FULL+DETAILS+FROM+OUR+SPECIAL+CORRESPONDENT.+ARRIVAL+OF+GEN.+BANKS+AT+THE+MISSISSIPPI--+TWO+FIGHTS+WITH+THE+REBELS--NO+FURTHER+NEWS+FROM+GRANT%2C+SHERMAN+OR+BUTLER%2C+DISPATCH+FROM+SECRETARY+STANTON.+DETAILS+OF+THE+MOVEMENT.+GEN.+GRANT%27S+MOVEMENTS--WOUNDED+OFFICERS+ARRIVED+AT+WASHINGTON.+ABANDONMENT+OF+FREDERICKSBURGH+AND+AQULA+CREEK--CAPTURE+OF+GUERRILLAS--INFAMOUS+ATTEMPT+TO+POISON+WOUNDED+SOLDIERS--THE+WRETCH+IN+DURANCE+VILE.+THE+OPERATIONS+OF+MOSEBY--THE+FREDERICKSBURGH+HOSTAGES.+BATTLE+REPORTS+VIA+PHILADELPHIA.+GEN.+BUTLER%27S+ARMY.+SITUATION+OF+AFFAIRS+AT+BERMUDA+HUNDRED.+ALL+QUIET+AT+BERMUDA.&amp;rft.au=&amp;rft.aulast=&amp;rft.aufirst=&amp;rft.date=1864-05-28&amp;rft.volume=&amp;rft.issue=&amp;rft.spage=1&amp;rft.isbn=&amp;rft.btitle=&amp;rft.title=New+York+Times+%281857-1922%29&amp;rft.issn=03624331,ProQuest Historical Newspapers: The New York Times (1851-2009) with Index (1851-1993)
THE FLANK MOVEMENT.,"The Army of the Potomac is again on the march toward Richmond. During the night, HANCOCK'S corps, which had held the left of our lines in front of Spottsylvania Court-house, took up its march, ...",91865144,Historical Newspapers," From Our Special Correspondent.
From Our Special Correspondent."," Copyright New York Times Company May 24, 1864"," 78724531-1 , 1446318 , 113715", front_page," May 24, 1864",0362-4331, English, English, 1," New York, N.Y.","May 24, 1864",New York Times (1857-1922),1864,http://search.proquest.com/docview/91865144?accountid=13567, 1,http://openurl.lib.rochester.edu/find?ctx_ver=Z39.88-2004&amp;ctx_enc=info:ofi/enc:UTF-8&amp;rfr_id=info:sid/ProQ%3Ahnpnewyorktimeswindex&amp;rft_val_fmt=info:ofi/fmt:kev:mtx:journal&amp;rft.genre=unknown&amp;rft.jtitle=New+York+Times+%281857-1922%29&amp;rft.atitle=THE+FLANK+MOVEMENT.%3A+LEE%27S+RIGHT+FLANK+EFFECTUALLY+TURNED+OUR+ADVANCE+EIGHTEEN+MILES+SOUTH+OF+SPOTTSYLVANIA+ON+SATURDAY-LEE+FALLING+BACK+HARD+FIGHTING+EXPECTED.&amp;rft.au=From+Our+Special+Correspondent.&amp;rft.aulast=From+Our+Special+Correspondent.&amp;rft.aufirst=&amp;rft.date=1864-05-24&amp;rft.volume=&amp;rft.issue=&amp;rft.spage=1&amp;rft.isbn=&amp;rft.btitle=&amp;rft.title=New+York+Times+%281857-1922%29&amp;rft.issn=03624331,ProQuest Historical Newspapers: The New York Times (1851-2009) with Index (1851-1993)
FROM SPOTTSYLVANIA COURT-HOUSE.,"IN THE FIELD, Wednesday, may 18,1864. The centre is the key of our present position... From Ny Run the ground, by a succession of gradations, reaches a very commanding height, and plainly overlooks a large field of open country, which is be-...",91748241,Historical Newspapers," Correspondence of the Washington Chronicle.
Correspondence of the Washington Chronicle."," Copyright New York Times Company May 23, 1864"," 80295107 , 1459058 , 113715", front_page," May 23, 1864",0362-4331, English, English, 1," New York, N.Y.","May 23, 1864",New York Times (1857-1922),1864,http://search.proquest.com/docview/91748241?accountid=13567, 1,http://openurl.lib.rochester.edu/find?ctx_ver=Z39.88-2004&amp;ctx_enc=info:ofi/enc:UTF-8&amp;rfr_id=info:sid/ProQ%3Ahnpnewyorktimeswindex&amp;rft_val_fmt=info:ofi/fmt:kev:mtx:journal&amp;rft.genre=unknown&amp;rft.jtitle=New+York+Times+%281857-1922%29&amp;rft.atitle=FROM+SPOTTSYLVANIA+COURT-HOUSE.%3A+TOPOGRAPHICAL+FEATURES--WEDNESDAY%27S+BATTLE.&amp;rft.au=Correspondence+of+the+Washington+Chronicle.&amp;rft.aulast=Correspondence+of+the+Washington+Chronicle.&amp;rft.aufirst=&amp;rft.date=1864-05-23&amp;rft.volume=&amp;rft.issue=&amp;rft.spage=1&amp;rft.isbn=&amp;rft.btitle=&amp;rft.title=New+York+Times+%281857-1922%29&amp;rft.issn=03624331,ProQuest Historical Newspapers: The New York Times (1851-2009) with Index (1851-1993)
RICHMOND.,"To Major-Gen. Dix: On Friday morning, Gen. GRANT commenced a movement for the purpose of compelling LEE to abandon his position at Spottsylvania (the details of which, for obvious reasons, should not be made public. It has thus far progressed successfully.",91813251,Historical Newspapers,," Copyright New York Times Company May 23, 1864"," 80295106 , 1459058 , 113715", front_page," May 23, 1864",0362-4331, English, English, 1," New York, N.Y.","May 23, 1864",New York Times (1857-1922),1864,http://search.proquest.com/docview/91813251?accountid=13567, 1,http://openurl.lib.rochester.edu/find?ctx_ver=Z39.88-2004&amp;ctx_enc=info:ofi/enc:UTF-8&amp;rfr_id=info:sid/ProQ%3Ahnpnewyorktimeswindex&amp;rft_val_fmt=info:ofi/fmt:kev:mtx:journal&amp;rft.genre=unknown&amp;rft.jtitle=New+York+Times+%281857-1922%29&amp;rft.atitle=RICHMOND.%3A+THE+ONWARD+MARCH+LEE+OUTFLANKED.+BRILLIANT+SUCCESS+OF+GRANT%27S+FLANK+MOVEMENT.+LONGSTREET+AND+EWELL+IN+RETREAT.+HANCOCK+AHEAD+OF+THEM+THE+REBEL+ARMY+BEYOND+THE+NORTH+ANNA.+GRANT%27S+LATEST+MOVEMENT+MANAGED+WITHOUT+SERIOUS+LOSS.+THE+NATIONAL+ARMY+SOUTH+OF+THE+MATTAPONY.+BETTER+NEWS+FROM+RED+RIVER.+SHERMAN+RESTING+AND+REPLENISHING.+BUTLER%27S+POSITION+UNCHANGED.+OFFICIAL.+GRANT%27S+FLANK+MOVEMENT+SO+FAR+SUCCESSFULADVICES+FROM+GENS%2C+CANBY+AND+SHERMANNOTHING+FROM+BUTLER.+GEN.+SHERMAN%27S+PROGRESS+HE+IS+REPLENISHING+SUPPLIES+AT+KINGSTON+CAPTURE+OF+IRONFOUNDRIES+AT+ROME+LATE+NEWS+FROM+GEN.+BANKS-MORE+FIGHTING+IN+BUTLER%27SARMY+A+HARD+BATTLE+ON+FRIDAY.WASHINGTON%2C+SATURDAY%2C+MAY+21%2C1864+9%3A50+P.M.+NO+FIGHTING+SINCE+THURSDAY-+IMPORTANT+MOVEMENTS+GOING+ON.&amp;rft.au=&amp;rft.aulast=&amp;rft.aufirst=&amp;rft.date=1864-05-23&amp;rft.volume=&amp;rft.issue=&amp;rft.spage=1&amp;rft.isbn=&amp;rft.btitle=&amp;rft.title=New+York+Times+%281857-1922%29&amp;rft.issn=03624331,ProQuest Historical Newspapers: The New York Times (1851-2009) with Index (1851-1993)
THE REBELLION.,"Secretary STANTON'S official dispatch of last evening conveys, in distinct terms, the very important intelligence that on Friday Gen. GRANT commenced a flank movement for the purpose of compelling LEE to abandon his position at Spottsylvania Court...",91808600,Historical Newspapers,," Copyright New York Times Company May 23, 1864"," 80295130-1 , 1459058 , 113715", article," May 23, 1864",0362-4331, English, English, 4," New York, N.Y.","May 23, 1864",New York Times (1857-1922),1864,http://search.proquest.com/docview/91808600?accountid=13567, 4,http://openurl.lib.rochester.edu/find?ctx_ver=Z39.88-2004&amp;ctx_enc=info:ofi/enc:UTF-8&amp;rfr_id=info:sid/ProQ%3Ahnpnewyorktimeswindex&amp;rft_val_fmt=info:ofi/fmt:kev:mtx:journal&amp;rft.genre=article&amp;rft.jtitle=New+York+Times+%281857-1922%29&amp;rft.atitle=THE+REBELLION.&amp;rft.au=&amp;rft.aulast=&amp;rft.aufirst=&amp;rft.date=1864-05-23&amp;rft.volume=&amp;rft.issue=&amp;rft.spage=4&amp;rft.isbn=&amp;rft.btitle=&amp;rft.title=New+York+Times+%281857-1922%29&amp;rft.issn=03624331,ProQuest Historical Newspapers: The New York Times (1851-2009) with Index (1851-1993)
ANOTHER FIGHT ON THURSDAY.,"WAR DEPARTMENT, WASHINGTON, May 20, 1864--6:30 P.M. This afternoon we have dispatches dated at 8 o'clock this morning from Gen. GRANT.",91821416,Historical Newspapers,," Copyright New York Times Company May 21, 1864"," 90119361 , 1523109 , 113715", front_page," May 21, 1864",0362-4331, English, English, 1," New York, N.Y.","May 21, 1864",New York Times (1857-1922),1864,http://search.proquest.com/docview/91821416?accountid=13567, 1,http://openurl.lib.rochester.edu/find?ctx_ver=Z39.88-2004&amp;ctx_enc=info:ofi/enc:UTF-8&amp;rfr_id=info:sid/ProQ%3Ahnpnewyorktimeswindex&amp;rft_val_fmt=info:ofi/fmt:kev:mtx:journal&amp;rft.genre=unknown&amp;rft.jtitle=New+York+Times+%281857-1922%29&amp;rft.atitle=ANOTHER+FIGHT+ON+THURSDAY.%3A+THE+REBELS+ATTEMPT+TO+TURN+OUR+RIGHT.+THEY+ARE+SEVERELY+REPULSED.+OFFICIAL+DISPATCH+FROM+SECRETARY+STANTON.+TWENTY-FIVE+THOUSAND+VETERAN+REINFORCEMENTS+JOINED+GEN.+GRANT.LATER+NEWS+FROM+GENERAL+SHERMAN.HIS+CONTINUED+PROGRESS.NEWS+FROM+GEN.+GRANT--ATTEMPT+BY+THEENEMY+TO+TURN+OUR+RIGHT--THE+EFFORT+PROMPTLY+REPULSED--25%2C000+VETERAN+REINFORCEMENTS+FOR+GRANT--LATE+NEWS+FROMSHERMAN--HIS+ARMY+STILL+PROGRESSING.%5BOFFICIAL.%5D&amp;rft.au=&amp;rft.aulast=&amp;rft.aufirst=&amp;rft.date=1864-05-21&amp;rft.volume=&amp;rft.issue=&amp;rft.spage=1&amp;rft.isbn=&amp;rft.btitle=&amp;rft.title=New+York+Times+%281857-1922%29&amp;rft.issn=03624331,ProQuest Historical Newspapers: The New York Times (1851-2009) with Index (1851-1993)
IMPORTANT.,"The skirmishing which began yesterday morning at daybreak settled into a heavy engagement, lasting through the forenoon, and culminating in another brilliant charge by HANCOCK on our right, when he drove the enemy a short distance, and carried their first line of intrenchments.",91836667,Historical Newspapers,," Copyright New York Times Company May 20, 1864"," 80294999-1 , 1459057 , 113715", front_page," May 20, 1864",0362-4331, English, English, 1," New York, N.Y.","May 20, 1864",New York Times (1857-1922),1864,http://search.proquest.com/docview/91836667?accountid=13567, 1,http://openurl.lib.rochester.edu/find?ctx_ver=Z39.88-2004&amp;ctx_enc=info:ofi/enc:UTF-8&amp;rfr_id=info:sid/ProQ%3Ahnpnewyorktimeswindex&amp;rft_val_fmt=info:ofi/fmt:kev:mtx:journal&amp;rft.genre=unknown&amp;rft.jtitle=New+York+Times+%281857-1922%29&amp;rft.atitle=IMPORTANT.%3A+ANOTHER+BATTLE+IN+VIRGINIA.+ANOTHER+BRILLIANT+CHARGE+BY+HANCOCK.+THE+FIRST+LINE+OF+REBEL+WORKS+CARRIED.+LEE%27S+LEFT+FLANK+TURNED.+ALL+THE+RESULTS+CONSIDERED+FAVORABLE.+THE+MOVEMENTS+OF+BOTH+ARMIES+ON+THURSDAY.+THE+BATTLE+NOT+RENEWED.+SPLENDID+SUCCESS+OF+GENERAL+SHERMAN.+ALL+QUIET+WITH+GENERAL+BUTLER.+THE+BATTLE+RENEWED+ON+WEDNESDAY--ANOTHER+GLORIOUS+CHARGE+BY+HANCOCK--THE+FIRST+LINE+OF+REBEL+WORKS+CARRIED--THE+RESULT+OF+THE+DAY%27S+FIGHTING+SOMEWHAT+FAVORABLE--THE+BATTLE+PROBABLY+RENEWED+YESTERDAY.&amp;rft.au=&amp;rft.aulast=&amp;rft.aufirst=&amp;rft.date=1864-05-20&amp;rft.volume=&amp;rft.issue=&amp;rft.spage=1&amp;rft.isbn=&amp;rft.btitle=&amp;rft.title=New+York+Times+%281857-1922%29&amp;rft.issn=03624331,ProQuest Historical Newspapers: The New York Times (1851-2009) with Index (1851-1993)
THE GREAT CAMPAIGN.,,91836819,Historical Newspapers," SPECIAL DISPATCHES TO THE N.Y. TIMES
SPECIAL DISPATCHES TO THE N.Y. TIMES"," Copyright New York Times Company May 19, 1864"," 88154425 , 1512547 , 113715", front_page," May 19, 1864",0362-4331, English, English, 1," New York, N.Y.","May 19, 1864",New York Times (1857-1922),1864,http://search.proquest.com/docview/91836819?accountid=13567, 1,http://openurl.lib.rochester.edu/find?ctx_ver=Z39.88-2004&amp;ctx_enc=info:ofi/enc:UTF-8&amp;rfr_id=info:sid/ProQ%3Ahnpnewyorktimeswindex&amp;rft_val_fmt=info:ofi/fmt:kev:mtx:journal&amp;rft.genre=unknown&amp;rft.jtitle=New+York+Times+%281857-1922%29&amp;rft.atitle=THE+GREAT+CAMPAIGN.%3A+THE+STRUGGLE+IN+VIRGINIA+RENEWED.+THE+BATTLE+AGAIN+OPENED+YESTERDAY+MORNING.+THE+ROADS+IMPROVED+AND+REINFORCEMENTS+ON+HAND.+GEN.+GRANT+%22MOVES+AGAINST+THE+ENEMY+WITHOUT+DELAY.%22+MOST+OF+THE+WOUNDED+REMOVED+FROM+FREDERICKSBURGH.+HANDSOME+VICTORY+IN+WESTERN+VIRGINIA.+THE+REBELS+DEFEATED+BY+GENERAL+CROOK.+ALL+QUIET--RECAPTURE%2C+OF+A+HOSPITAL--SUFFERINGS+OF+THE+WOUNDED.&amp;rft.au=SPECIAL+DISPATCHES+TO+THE+N.Y.+TIMES&amp;rft.aulast=SPECIAL+DISPATCHES+TO+THE+N.Y.+TIMES&amp;rft.aufirst=&amp;rft.date=1864-05-19&amp;rft.volume=&amp;rft.issue=&amp;rft.spage=1&amp;rft.isbn=&amp;rft.btitle=&amp;rft.title=New+York+Times+%281857-1922%29&amp;rft.issn=03624331,ProQuest Historical Newspapers: The New York Times (1851-2009) with Index (1851-1993)
FROM GEN. GRANT'S ARMY.,"I have just returned from the scene of Gen. HANCOCK's brilliant victory of yesterday morning. At the point at which his assault was made, the rebel breastworks formed an angle or salient, and his men advanced silently and, without firing a shot, entered...",91834269,Historical Newspapers," From Our Special Correspondent.
From Our Special Correspondent."," Copyright New York Times Company May 18, 1864"," 78724363 , 1446316 , 113715", front_page," May 18, 1864",0362-4331, English, English, 1," New York, N.Y.","May 18, 1864",New York Times (1857-1922),1864,http://search.proquest.com/docview/91834269?accountid=13567, 1,http://openurl.lib.rochester.edu/find?ctx_ver=Z39.88-2004&amp;ctx_enc=info:ofi/enc:UTF-8&amp;rfr_id=info:sid/ProQ%3Ahnpnewyorktimeswindex&amp;rft_val_fmt=info:ofi/fmt:kev:mtx:journal&amp;rft.genre=unknown&amp;rft.jtitle=New+York+Times+%281857-1922%29&amp;rft.atitle=FROM+GEN.+GRANT%27S+ARMY.%3A+THE+LATEST.+ADDITIONAL+CASUALTIES.&amp;rft.au=From+Our+Special+Correspondent.&amp;rft.aulast=From+Our+Special+Correspondent.&amp;rft.aufirst=&amp;rft.date=1864-05-18&amp;rft.volume=&amp;rft.issue=&amp;rft.spage=1&amp;rft.isbn=&amp;rft.btitle=&amp;rft.title=New+York+Times+%281857-1922%29&amp;rft.issn=03624331,ProQuest Historical Newspapers: The New York Times (1851-2009) with Index (1851-1993)
REPORTS FROM WASHINGTON.,"The rebels up to yesterday occupied their line of entrenchments immediately around and this side of Spottsylvania Court-house. Both armies lay on their arms on Sunday night, expecting an attack. The rebel works bear all appearance of having been but recently thrown up. A few hours' sunshine will remove all impediment to the resumption of active hostilities. LEE'S position is described as being a very strong one in itself, but it can be flanked with.",91821222,Historical Newspapers,," Copyright New York Times Company May 18, 1864"," 78724362 , 1446316 , 113715", front_page," May 18, 1864",0362-4331, English, English, 1," New York, N.Y.","May 18, 1864",New York Times (1857-1922),1864,http://search.proquest.com/docview/91821222?accountid=13567, 1,http://openurl.lib.rochester.edu/find?ctx_ver=Z39.88-2004&amp;ctx_enc=info:ofi/enc:UTF-8&amp;rfr_id=info:sid/ProQ%3Ahnpnewyorktimeswindex&amp;rft_val_fmt=info:ofi/fmt:kev:mtx:journal&amp;rft.genre=unknown&amp;rft.jtitle=New+York+Times+%281857-1922%29&amp;rft.atitle=REPORTS+FROM+WASHINGTON.%3A+OUR+FORCES+RESTING+AND+RECRUITING+FOR+ANOTHER+STRUGGLE+AN+UNSUCCESSFUL+MOVEMENT+AGAINST+THE+TRAINS.&amp;rft.au=&amp;rft.aulast=&amp;rft.aufirst=&amp;rft.date=1864-05-18&amp;rft.volume=&amp;rft.issue=&amp;rft.spage=1&amp;rft.isbn=&amp;rft.btitle=&amp;rft.title=New+York+Times+%281857-1922%29&amp;rft.issn=03624331,ProQuest Historical Newspapers: The New York Times (1851-2009) with Index (1851-1993)
THE SITUATION IN VIRGINIA.,We have no official intelligence of any military operations since my last dispatch. The Richmond papers of Saturday state that Gen. STEELE had sur,91815104,Historical Newspapers,," Copyright New York Times Company May 18, 1864"," 78724361 , 1446316 , 113715", front_page," May 18, 1864",0362-4331, English, English, 1," New York, N.Y.","May 18, 1864",New York Times (1857-1922),1864,http://search.proquest.com/docview/91815104?accountid=13567, 1,http://openurl.lib.rochester.edu/find?ctx_ver=Z39.88-2004&amp;ctx_enc=info:ofi/enc:UTF-8&amp;rfr_id=info:sid/ProQ%3Ahnpnewyorktimeswindex&amp;rft_val_fmt=info:ofi/fmt:kev:mtx:journal&amp;rft.genre=unknown&amp;rft.jtitle=New+York+Times+%281857-1922%29&amp;rft.atitle=THE+SITUATION+IN+VIRGINIA.%3A+GRANT+CONCENTRATING+FOR+A+TREMENDOUS+EFFORT.+LEE+STILL+IN+A+STRONG+POSITION.+HORRIBLE+CONDITION+OF+THE+ROADS.+REST+FOR+THE+ARMY+AND+SUCCOR+FOR+THE+WOUNDED.+FULL+DETAILS+OF+GENERAL+BUTLER%27S+OPERATIONS.+HIGHLY+ENCOURAGING+NEWS+FROM+GENERAL+SHERMAN.+NO+LATE+MILITARY+INTELLIGENCE+IN+WASHINGTON+STEELE%27S+REPORTED+SURRENDER+UNTRUE+SHERMAN+VIGOROUSLY+PURSUING+JOHNSTON.%5BOFFICIAL.%5D&amp;rft.au=&amp;rft.aulast=&amp;rft.aufirst=&amp;rft.date=1864-05-18&amp;rft.volume=&amp;rft.issue=&amp;rft.spage=1&amp;rft.isbn=&amp;rft.btitle=&amp;rft.title=New+York+Times+%281857-1922%29&amp;rft.issn=03624331,ProQuest Historical Newspapers: The New York Times (1851-2009) with Index (1851-1993)
THE GRAND CAMPAIGN.,"Major-Gen. Dix, New-York: We have dispatches from Gen. GRANT to 8 o'clock this morning. He states that offensive operations have been necessarily suspended until the roads become passable; that the army is in the best of spirits, and feels the fullest confidence in success. The two armies are now concentrated on the main road from Fredericksburgh to Richmond.",91833059,Historical Newspapers,," Copyright New York Times Company May 17, 1864"," 80294903 , 1459056 , 113715", front_page," May 17, 1864",0362-4331, English, English, 1," New York, N.Y.","May 17, 1864",New York Times (1857-1922),1864,http://search.proquest.com/docview/91833059?accountid=13567, 1,http://openurl.lib.rochester.edu/find?ctx_ver=Z39.88-2004&amp;ctx_enc=info:ofi/enc:UTF-8&amp;rfr_id=info:sid/ProQ%3Ahnpnewyorktimeswindex&amp;rft_val_fmt=info:ofi/fmt:kev:mtx:journal&amp;rft.genre=unknown&amp;rft.jtitle=New+York+Times+%281857-1922%29&amp;rft.atitle=THE+GRAND+CAMPAIGN.%3A+THE+SITUATION+IN+VIRGINIA.+ADVICES+FROM+GENERAL+GRANT+TO+MONDAY+MORNING.+HOSTILITIES+SUSPENDED+BY+IMPASSABLE+ROADS.+THE+TROOPS+IN+FINE+SPIRITS.+LEE+FORTIFYING+HIS+POSITION+STRONGLY.+GEN.+WADSWORTH%27S+BODY+RECOVERED.+GENERAL+BUTLER+LAYING+SIEGE+TO+FORT+DARLING.+CHEERING+NEWS+FROM+GENERAL+SHERMAN.+TWO+DAYS%27+HARD+FIGHTING+WITH+GOOD+RESULTS.+THE+REBELS+ABANDON+RESACA+AND+RETREAT.+OUR+FORCES+IN+VIGOROUS+PURSUIT.+DISPATCHES+FROM+THE+WAR+OFFICE.+DELAY+OF+OFFENSIVE+OPERATIONS--IMPASSABLE+CONDITION+OF+THE+ROADS--FINE+SPIRITS+OF+THE+TROOPS--BOTH+ARMIES+CONCENTRATED+ON+THE+ROAD+TO+RICHMOND--EVACUATION+OF+RESACA+BY+JOHNSTON--BUTLER+STILL+OPERATING+AGAINST+FORT+DARLING.%5BOFFICIAL.%5D+FROM+THE+ARMIES+IN+VIRGINIA-INTELLIGENCE+FROM+RESACA+TWO+LINES+OF+THE+ENEMY%27S+WORKS+STORMED.+%5BOFFICIAL.%5D&amp;rft.au=&amp;rft.aulast=&amp;rft.aufirst=&amp;rft.date=1864-05-17&amp;rft.volume=&amp;rft.issue=&amp;rft.spage=1&amp;rft.isbn=&amp;rft.btitle=&amp;rft.title=New+York+Times+%281857-1922%29&amp;rft.issn=03624331,ProQuest Historical Newspapers: The New York Times (1851-2009) with Index (1851-1993)
Very Latest from General Grant.,Dispatches from General Grant have been received by this Department down to seven o'clock this morning. There had been no engagement for the last two days.,91857057,Historical Newspapers,," Copyright New York Times Company May 16, 1864"," 79180761-1 , 1450891 , 113715", front_page," May 16, 1864",0362-4331, English, English, 1," New York, N.Y.","May 16, 1864",New York Times (1857-1922),1864,http://search.proquest.com/docview/91857057?accountid=13567, 1,http://openurl.lib.rochester.edu/find?ctx_ver=Z39.88-2004&amp;ctx_enc=info:ofi/enc:UTF-8&amp;rfr_id=info:sid/ProQ%3Ahnpnewyorktimeswindex&amp;rft_val_fmt=info:ofi/fmt:kev:mtx:journal&amp;rft.genre=unknown&amp;rft.jtitle=New+York+Times+%281857-1922%29&amp;rft.atitle=Very+Latest+from+General+Grant.%3A+LEE+STILL+RETREATING.+No+Fighting+on+Friday+or+Saturday.+Glorious+Work+of+General+Sheridan.+Railroads+Destroyed%2C+Supplies+Captured+and+Burned+and+the+Rebel+Cavalry+Defeated.+The+Rebel+Gen.+J.+E.+B.+Stuart+Killed.+Fort+Darling+Attacked+by+Gen.+Butler.+A+PORTION+OF+THE+WORKS+CARRIED.+REBEL+REINFORCEMENTS+CUT+OFF+Highly+Important+from+Gen.+Sherman.+A+Great+Battle+Going+on+Near+Dalton.+DISPATCHES+FROM+THE+WAR+OFFICE.+The+Latest+Army+News--Advices+from+Gen.+Grant+to+Sunday+Morning--No+more+Flighting--News+from+Gen.+Sherman+to+Saturday+Evening--His+Army+Actively+Engaged.+%28OFFICIAL.%29+Dispatches+from+Gen.+Grant+to+Half-past+Six+Saturday+Morning--Retreat+of+Lee.+SHERIDAN%27S+GREAT+CAVALRY+RAID.+The+Retreat+of+Lee+and+Pursuit+by+Grant--The+News+from+Sherman--Dalton+Evacuated--Sigel%27s+Position.+Gen.+Butler%27s+Attack+on+Fort+Darling--The+Enemy%27s+First+Line+Carried.+The+Arrival+of+Prisoners+at+Belle+Plain.&amp;rft.au=&amp;rft.aulast=&amp;rft.aufirst=&amp;rft.date=1864-05-16&amp;rft.volume=&amp;rft.issue=&amp;rft.spage=1&amp;rft.isbn=&amp;rft.btitle=&amp;rft.title=New+York+Times+%281857-1922%29&amp;rft.issn=03624331,ProQuest Historical Newspapers: The New York Times (1851-2009) with Index (1851-1993)
LATEST FROM THE ARMY,"The latest intelligence rcceived here from the front, through unofficial sources, is up to yesterday, at 1 o'clock. On Saturday evening, just before dusk,",91838605,Historical Newspapers,," Copyright New York Times Company May 16, 1864"," 79180859 , 1450891 , 113715", article," May 16, 1864",0362-4331, English, English, 8," New York, N.Y.","May 16, 1864",New York Times (1857-1922),1864,http://search.proquest.com/docview/91838605?accountid=13567, 8,http://openurl.lib.rochester.edu/find?ctx_ver=Z39.88-2004&amp;ctx_enc=info:ofi/enc:UTF-8&amp;rfr_id=info:sid/ProQ%3Ahnpnewyorktimeswindex&amp;rft_val_fmt=info:ofi/fmt:kev:mtx:journal&amp;rft.genre=article&amp;rft.jtitle=New+York+Times+%281857-1922%29&amp;rft.atitle=LATEST+FROM+THE+ARMY%3A+A+SAVAGE+FIGHT+ON+SATURDAY+EVENING.+THE+REBELS+REPULSED+AND+A+BATTERY+CAPTURED.+FRESH+TROOPS+ARRIVING+TO+AID+GRANT.+LEE%27S+ARMY+ON+QUARTER+RATIONS%2C+BUT+MASSED+FOR+MORE+FIGHTING.+SPECIAL+DISPATCHES+TO+THE+N.Y.+TIMES.&amp;rft.au=&amp;rft.aulast=&amp;rft.aufirst=&amp;rft.date=1864-05-16&amp;rft.volume=&amp;rft.issue=&amp;rft.spage=8&amp;rft.isbn=&amp;rft.btitle=&amp;rft.title=New+York+Times+%281857-1922%29&amp;rft.issn=03624331,ProQuest Historical Newspapers: The New York Times (1851-2009) with Index (1851-1993)
REPORTS FROM PHILADELPHIA.,,91816188,Historical Newspapers,," Copyright New York Times Company May 15, 1864"," 80294849 , 1459055 , 113715", front_page," May 15, 1864",0362-4331, English, English, 1," New York, N.Y.","May 15, 1864",New York Times (1857-1922),1864,http://search.proquest.com/docview/91816188?accountid=13567, 1,http://openurl.lib.rochester.edu/find?ctx_ver=Z39.88-2004&amp;ctx_enc=info:ofi/enc:UTF-8&amp;rfr_id=info:sid/ProQ%3Ahnpnewyorktimeswindex&amp;rft_val_fmt=info:ofi/fmt:kev:mtx:journal&amp;rft.genre=unknown&amp;rft.jtitle=New+York+Times+%281857-1922%29&amp;rft.atitle=REPORTS+FROM+PHILADELPHIA.%3A+GRANT%27S+ARMY+SAID+TO+BE+SOUTH+OF+THE+PO--THE+REBEL+REARGUARD+OVERTAKEN.&amp;rft.au=&amp;rft.aulast=&amp;rft.aufirst=&amp;rft.date=1864-05-15&amp;rft.volume=&amp;rft.issue=&amp;rft.spage=1&amp;rft.isbn=&amp;rft.btitle=&amp;rft.title=New+York+Times+%281857-1922%29&amp;rft.issn=03624331,ProQuest Historical Newspapers: The New York Times (1851-2009) with Index (1851-1993)
THE VICTORY.,"Maj.-Gen: Dix: A dispatch from the Commissary of Prisoners at Belle Plain, announces the arrival there of over 7,000 prisoners, including 400 officers, with Maj.-Gen. Johnson and Brig.-Gen. STUART.",91815474,Historical Newspapers," EDWIN M. STANTON, Secretary of War.
EDWIN M. STANTON, Secretary of War."," Copyright New York Times Company May 15, 1864"," 80294843-1 , 1459055 , 113715", front_page," May 15, 1864",0362-4331, English, English, 1," New York, N.Y.","May 15, 1864",New York Times (1857-1922),1864,http://search.proquest.com/docview/91815474?accountid=13567, 1,http://openurl.lib.rochester.edu/find?ctx_ver=Z39.88-2004&amp;ctx_enc=info:ofi/enc:UTF-8&amp;rfr_id=info:sid/ProQ%3Ahnpnewyorktimeswindex&amp;rft_val_fmt=info:ofi/fmt:kev:mtx:journal&amp;rft.genre=unknown&amp;rft.jtitle=New+York+Times+%281857-1922%29&amp;rft.atitle=THE+VICTORY.%3A+%27GENERAL+MEADE+REVIEWS+THE+SITUATION.+AN+EIGHT+DAYS%27+RETROSPECT.+8%2C000+REBEL+PRISONERS.+CAPTURE+OF+EIGHTEEN+GUNS+AND+TWENTY+COLORS.+A+LULL+IN+THE+STRUGGLE.+LEE+FALLEN+BACK+TO+A+NEW+LINE.+THE+TOTAL+UNION+LOSS+TWENTY+THOUSAND.+REINFORCEMENTS+FOR+GRANT.+GEN.+BUTLER+IN+GOOD+POSITION.+VICTORY+IN+THE+SOUTHWEST.+SHERMAN+IN+THE+REAR+OF+JOHNSTON%27S+ARMY.+THE+REBELS+RETREAT+BEYOND+RESACA.+GEN.+SIGEL+AT+WOODSTOCK.+EXCHANGE+OF+PRISONERS+OF+WAR+%5BOFFICIAL.%5D+SECOND+DISPATCH.+THIRD+DISPATCH.+GEN.%2C+MEADE+TO+THE+ARMY.&amp;rft.au=EDWIN+M.+STANTON%2C+Secretary+of+War.&amp;rft.aulast=EDWIN+M.+STANTON&amp;rft.aufirst=Secretary+of&amp;rft.date=1864-05-15&amp;rft.volume=&amp;rft.issue=&amp;rft.spage=1&amp;rft.isbn=&amp;rft.btitle=&amp;rft.title=New+York+Times+%281857-1922%29&amp;rft.issn=03624331,ProQuest Historical Newspapers: The New York Times (1851-2009) with Index (1851-1993)
