Title,Abstract,StoreId,ArticleType,Authors,copyright,digitalObjectIdentifier,documentType,entryDate,issn,language,languageOfSummary,pages,placeOfPublication,pubdate,pubtitle,year,DocumentURL,startPage,FindACopy,Database
"""ON TO RICHMOND.""",,91847348,Historical Newspapers,," Copyright New York Times Company May 10, 1864"," 80294704-1 , 1459054 , 113715", front_page," May 10, 1864",0362-4331, English, English, 1," New York, N.Y.","May 10, 1864",New York Times (1857-1922),1864,http://search.proquest.com/docview/91847348?accountid=13567, 1,http://openurl.lib.rochester.edu/find?ctx_ver=Z39.88-2004&amp;ctx_enc=info:ofi/enc:UTF-8&amp;rfr_id=info:sid/ProQ%3Ahnpnewyorktimeswindex&amp;rft_val_fmt=info:ofi/fmt:kev:mtx:journal&amp;rft.genre=unknown&amp;rft.jtitle=New+York+Times+%281857-1922%29&amp;rft.atitle=%22ON+TO+RICHMOND.%22%3A+LEE%27S+DEFEAT+AND+RETREAT+FULLY+CONFIRMED.+OUR+ARMY+IN+VIGOROUS+PURSUIT.+OFFICIAL+DISPATCHES+FROM+GRANT+AND+MEADE.+LEE%27S+REPORT+OF+THE+BATTLES.+THE+REBEL+DEAD+AND+WOUNDED+LEFT+ON+THE+FIELD.+ADVANCE+OF+HANCOCK.+HE+PASSES+THROUGH+SPOTTSYLVANIA+ON+SUNDAY.+TWO+THOUSAND+PRISONERS+CAPTURED.+FREDERICKSBURG+AGAIN+OCCUPIED+A+DEPOT+FOR+THE+WOUNDED+ESTABLISHED+THERE.IMPORTANT+FROM+GEN.+BUTLER.A+SEVERE+BATTLE+FOUGHT+ON+SATURDAY.+THE+RAILROAD+DESTROYED+BETWEEN+PETERSBURGH+AND+RICHMOND.+CAPTURE+OF+THE+GUNBOAT+SHOSHONE.THE+CASULTIES+OF+THE+BATTLES.GEN.+WADSWORTH+KILLED+THE+REBEL+LONGSTREET+MORTALLYWOUNDED.PROCLAMATION+FROM+THE+PRESIDENTEXECUTIVE+RECOMMENDATIONFOR+PRAYER+AND+ESPECIAL+GRATITUDE+TO+GOD%2CIN+VIEW+OF+THE+GREAT+VICTORY.&amp;rft.au=&amp;rft.aulast=&amp;rft.aufirst=&amp;rft.date=1864-05-10&amp;rft.volume=&amp;rft.issue=&amp;rft.spage=1&amp;rft.isbn=&amp;rft.btitle=&amp;rft.title=New+York+Times+%281857-1922%29&amp;rft.issn=03624331,ProQuest Historical Newspapers: The New York Times (1851-2009) with Index (1851-1993)
GLORIOUS NEWS,"We have no official reports from the front, but the Medical Director has notified the Surgeon-General that our wounded were being sent to Washington, and will number from six to eight thousand.",91838172,Historical Newspapers,," Copyright New York Times Company May 9, 1864"," 80294601-1 , 1459052 , 113715", front_page," May 9, 1864",0362-4331, English, English, 1," New York, N.Y.","May 9, 1864",New York Times (1857-1922),1864,http://search.proquest.com/docview/91838172?accountid=13567, 1,http://openurl.lib.rochester.edu/find?ctx_ver=Z39.88-2004&amp;ctx_enc=info:ofi/enc:UTF-8&amp;rfr_id=info:sid/ProQ%3Ahnpnewyorktimeswindex&amp;rft_val_fmt=info:ofi/fmt:kev:mtx:journal&amp;rft.genre=unknown&amp;rft.jtitle=New+York+Times+%281857-1922%29&amp;rft.atitle=GLORIOUS+NEWS%3A+DEFEAT+AND+RETREAT+OF+LEE%27S+ARMY.+TWO+DAYS+BATTLE+IN+VIRGINIA.+LIEUT-GENERAL+GRANT+AGAINST+GEN.+LEE.+THE+STRUGGLE+OF+THURSDAY+AND+OF+FRIDAY+IN+THE+WILDERNESS.+IMMENSE+REBEL+LOSSES.+LEE+LEAVES+HIS+KILLED+AND+WOUNDED+IN+OUR+HANDS.+OUR+LOSS+TWELVE+THOUSAND.+GEN.+BUTLER%27S+OPERATIONS.+CAPTURE+OF+CITY+POINT+AND+REPORTED+OCCUPATION+OF+PETERSBURGH.+RALIROAD+COMMUNICATION+DESTROYED.+GEN.+SHERMAN%27S+MOVEMENTS+IN+GEORGIA.+ADVANCE+TO+TUNNELL+HILL.+RETREAT+OF+JOE+JOHNSTON%27S+ARMY+TOWARD+ATLANTA.+DISPATCHES+FROM+THE+WAR+OFFICE.+FIRST+DISPATCH.+GEN.+GRANT+SUCCESSFUL+LEE+REPORTED+TO+BE+RETIRING+GEN.+SHERMAN+ADVANCING+TUNNEL+HILL+OCCUPIED.&amp;rft.au=&amp;rft.aulast=&amp;rft.aufirst=&amp;rft.date=1864-05-09&amp;rft.volume=&amp;rft.issue=&amp;rft.spage=1&amp;rft.isbn=&amp;rft.btitle=&amp;rft.title=New+York+Times+%281857-1922%29&amp;rft.issn=03624331,ProQuest Historical Newspapers: The New York Times (1851-2009) with Index (1851-1993)
Official Dispatch from Gen. Butler to Gen. Grant.,"Lieut.-Gen. Grant, Commanding Armies of the United States, Washington, D.C.: We have seized Wilson's Wharf Landing. A brigade of WILD'S Colored troops are there. At Fort Powhatan Landing two regiments of the same brigade have landed. At City Point HINKS' Division, with the remaining troops and battery, have landed. The remainder of both the Eighteenth and Tenth Army Corps are being landed at Bermuda Hundreds, above the Appomattox.",91816153,Historical Newspapers,," Copyright New York Times Company May 9, 1864"," 80294608-1 , 1459052 , 113715", front_page," May 9, 1864",0362-4331, English, English, 1," New York, N.Y.","May 9, 1864",New York Times (1857-1922),1864,http://search.proquest.com/docview/91816153?accountid=13567, 1,http://openurl.lib.rochester.edu/find?ctx_ver=Z39.88-2004&amp;ctx_enc=info:ofi/enc:UTF-8&amp;rfr_id=info:sid/ProQ%3Ahnpnewyorktimeswindex&amp;rft_val_fmt=info:ofi/fmt:kev:mtx:journal&amp;rft.genre=unknown&amp;rft.jtitle=New+York+Times+%281857-1922%29&amp;rft.atitle=Official+Dispatch+from+Gen.+Butler+to+Gen.+Grant.&amp;rft.au=&amp;rft.aulast=&amp;rft.aufirst=&amp;rft.date=1864-05-09&amp;rft.volume=&amp;rft.issue=&amp;rft.spage=1&amp;rft.isbn=&amp;rft.btitle=&amp;rft.title=New+York+Times+%281857-1922%29&amp;rft.issn=03624331,ProQuest Historical Newspapers: The New York Times (1851-2009) with Index (1851-1993)
SPECIAL DISPATCHES TO THE N.Y. TIMES,"The latest news from the army received here is up to seven o'clock yesterday evening, at which time GRANT fully maintained his position. The fighting on Thursday and Friday was very severe, with skirmishing only on Saturday. LEE'S first onset was made upon our left, but failing he then fell upon our centre and finally upon our right, where the hardest contest took place.",91818579,Historical Newspapers,," Copyright New York Times Company May 9, 1864"," 80294603 , 1459052 , 113715", front_page," May 9, 1864",0362-4331, English, English, 1," New York, N.Y.","May 9, 1864",New York Times (1857-1922),1864,http://search.proquest.com/docview/91818579?accountid=13567, 1,http://openurl.lib.rochester.edu/find?ctx_ver=Z39.88-2004&amp;ctx_enc=info:ofi/enc:UTF-8&amp;rfr_id=info:sid/ProQ%3Ahnpnewyorktimeswindex&amp;rft_val_fmt=info:ofi/fmt:kev:mtx:journal&amp;rft.genre=unknown&amp;rft.jtitle=New+York+Times+%281857-1922%29&amp;rft.atitle=SPECIAL+DISPATCHES+TO+THE+N.Y.+TIMES%3A+FRIDAY%27S+BATTLE.+FIRST+DISPATCH.&amp;rft.au=&amp;rft.aulast=&amp;rft.aufirst=&amp;rft.date=1864-05-09&amp;rft.volume=&amp;rft.issue=&amp;rft.spage=1&amp;rft.isbn=&amp;rft.btitle=&amp;rft.title=New+York+Times+%281857-1922%29&amp;rft.issn=03624331,ProQuest Historical Newspapers: The New York Times (1851-2009) with Index (1851-1993)
SECOND DISPATCH.,"Your special correspondent, writing from headquarters at Wilderness Tavern, Friday evening, May 6, gives the following intelligence of the great battle on Friday:",91841385,Historical Newspapers,," Copyright New York Times Company May 9, 1864"," 80294604 , 1459052 , 113715", front_page," May 9, 1864",0362-4331, English, English, 1," New York, N.Y.","May 9, 1864",New York Times (1857-1922),1864,http://search.proquest.com/docview/91841385?accountid=13567, 1,http://openurl.lib.rochester.edu/find?ctx_ver=Z39.88-2004&amp;ctx_enc=info:ofi/enc:UTF-8&amp;rfr_id=info:sid/ProQ%3Ahnpnewyorktimeswindex&amp;rft_val_fmt=info:ofi/fmt:kev:mtx:journal&amp;rft.genre=unknown&amp;rft.jtitle=New+York+Times+%281857-1922%29&amp;rft.atitle=SECOND+DISPATCH.&amp;rft.au=&amp;rft.aulast=&amp;rft.aufirst=&amp;rft.date=1864-05-09&amp;rft.volume=&amp;rft.issue=&amp;rft.spage=1&amp;rft.isbn=&amp;rft.btitle=&amp;rft.title=New+York+Times+%281857-1922%29&amp;rft.issn=03624331,ProQuest Historical Newspapers: The New York Times (1851-2009) with Index (1851-1993)
THE BATTLE.,"The statements which were received here today, and which are entitled to belief, are that Gen. LEE made a tremendous and violent attack to pierce our centre, hoping thereby to divide our forces and to secure a victory; but Gen. HITCHCOCK'S corps came to the relief, and, amid a murderous fire, formed in line of battle, and thwarted the designs of the rebels. The loss was heavy on both sides.",91840726,Historical Newspapers,," Copyright New York Times Company May 8, 1864"," 78723738-1 , 1446311 , 113715", front_page," May 8, 1864",0362-4331, English, English, 1," New York, N.Y.","May 8, 1864",New York Times (1857-1922),1864,http://search.proquest.com/docview/91840726?accountid=13567, 1,http://openurl.lib.rochester.edu/find?ctx_ver=Z39.88-2004&amp;ctx_enc=info:ofi/enc:UTF-8&amp;rfr_id=info:sid/ProQ%3Ahnpnewyorktimeswindex&amp;rft_val_fmt=info:ofi/fmt:kev:mtx:journal&amp;rft.genre=unknown&amp;rft.jtitle=New+York+Times+%281857-1922%29&amp;rft.atitle=THE+BATTLE.%3A+IMPORTANT+NEWS+FROM+VIRGINIA.+A+GREAT+BATTLE+BEGUN+ON+THURSDAY.+LEE+CONFRONTS+GRANT+WITH+HIS+WHOLE+ARMY.+SEVERE+ENGAGEMENT+BETWEEN+HANCOCK+AND+LONGSTREET.+HEAVY+LOSS+ON+BOTH+SIDES.+THE+FIFTH+CORPS+ALSO+PARTLY+ENGAGED.+THE+BATTLE+RENEWED+ON+FRIDAY+MORNING.+GEN.+BURNSIDE%27S+CORPS+ON+THE+GROUND+FOR+SUPPORT.+STUART%27S+CAVALRY+ROUTED+BY+SHERIDAN+THE+TROOPS+ENTHUSIASTIC+TO+A+HIGH+DEGREE.+HIGHLY+IMPORTANT+FROM+BUTLER%27S+ARMY+VERY+SUCCESSFUL+LANDING+AT+CITY+POINT.+THE+REBELS+COMPLETELY+SURPRISED.+CAVALRY+EXPEDITION+TO+DESTROY+THE+RICHMOND+AND+PETERSBURGH+RAILROAD.+FALL+PARTICULARS+FROM+OUR+SPECIAL+CORRESPONDENT.&amp;rft.au=&amp;rft.aulast=&amp;rft.aufirst=&amp;rft.date=1864-05-08&amp;rft.volume=&amp;rft.issue=&amp;rft.spage=1&amp;rft.isbn=&amp;rft.btitle=&amp;rft.title=New+York+Times+%281857-1922%29&amp;rft.issn=03624331,ProQuest Historical Newspapers: The New York Times (1851-2009) with Index (1851-1993)
