Title,Abstract,StoreId,ArticleType,copyright,digitalObjectIdentifier,documentType,entryDate,issn,language,languageOfSummary,pages,placeOfPublication,pubdate,pubtitle,year,DocumentURL,startPage,FindACopy,Database
The Failure Before Petersburgh Health of the Army Arduous Service of the Cavalry Temper of the Soldiers.,"Sinces the recent unfortunate fiasco this army has sattled down into its wonted quiet. Of course, the failure of the plans laid to capture Petersburgh by surprise, as it were, is the grand topic of conversation among both officers and men, and all feel that there was a serious mistake made by some one. Who shall be held responsible, is the subject under consideration by a competent tribunal. The result of the investigation, it is generally believed, will not be the stereotyped one usually found by coroners' juries upon investigating steamboat explosions and disasters upon railroads. The prevailing opinion is that in the present instance somebody should be held responsible for failing to accomplish such an important result as was reasonably anticipated.",91821792,Historical Newspapers," Copyright New York Times Company Aug 11, 1864"," 78991516 , 1449482 , 113715", article," Aug 11, 1864",0362-4331, English, English, 5," New York, N.Y.","Aug 11, 1864",New York Times (1857-1922),1864,http://search.proquest.com/docview/91821792?accountid=13567, 5,http://openurl.lib.rochester.edu/find?ctx_ver=Z39.88-2004&amp;ctx_enc=info:ofi/enc:UTF-8&amp;rfr_id=info:sid/ProQ%3Ahnpnewyorktimeswindex&amp;rft_val_fmt=info:ofi/fmt:kev:mtx:journal&amp;rft.genre=article&amp;rft.jtitle=New+York+Times+%281857-1922%29&amp;rft.atitle=The+Failure+Before+Petersburgh+Health+of+the+Army+Arduous+Service+of+the+Cavalry+Temper+of+the+Soldiers.&amp;rft.au=&amp;rft.aulast=&amp;rft.aufirst=&amp;rft.date=1864-08-11&amp;rft.volume=&amp;rft.issue=&amp;rft.spage=5&amp;rft.isbn=&amp;rft.btitle=&amp;rft.title=New+York+Times+%281857-1922%29&amp;rft.issn=03624331,ProQuest Historical Newspapers: The New York Times (1851-2009) with Index (1851-1993)
Another Account.,"MY DEAR FRIEND: I know you like to have a word from an old friend. I wish that word were a cheery one, but as a faithful chronicler of events, I must state them as near truth as I can get them. Ere this reaches you, perhaps you may learn of our last exploit before Petersburgh. Every loyal man had heard of the mining operations before Petersburgh, and all true men hoped our cause would be advanced by them, but alas for all human calculations, the 's children have had their father's luck again. On Saturday morning last, as you may have read, we blew one of the forts of the enemy all to smasu, and in the ruins of the fort were buried two ...",91895616,Historical Newspapers," Copyright New York Times Company Aug 7, 1864"," 80297280 , 1459079 , 113715", front_page," Aug 7, 1864",0362-4331, English, English, 1," New York, N.Y.","Aug 7, 1864",New York Times (1857-1922),1864,http://search.proquest.com/docview/91895616?accountid=13567, 1,http://openurl.lib.rochester.edu/find?ctx_ver=Z39.88-2004&amp;ctx_enc=info:ofi/enc:UTF-8&amp;rfr_id=info:sid/ProQ%3Ahnpnewyorktimeswindex&amp;rft_val_fmt=info:ofi/fmt:kev:mtx:journal&amp;rft.genre=unknown&amp;rft.jtitle=New+York+Times+%281857-1922%29&amp;rft.atitle=Another+Account.&amp;rft.au=&amp;rft.aulast=&amp;rft.aufirst=&amp;rft.date=1864-08-07&amp;rft.volume=&amp;rft.issue=&amp;rft.spage=1&amp;rft.isbn=&amp;rft.btitle=&amp;rft.title=New+York+Times+%281857-1922%29&amp;rft.issn=03624331,ProQuest Historical Newspapers: The New York Times (1851-2009) with Index (1851-1993)
"Casualties in the Forty-eighth New-York Volunteers in Engagement before Petersburgh, July 30, 1864.",,91865806,Historical Newspapers," Copyright New York Times Company Aug 7, 1864"," 80297285 , 1459079 , 113715", front_page," Aug 7, 1864",0362-4331, English, English, 1," New York, N.Y.","Aug 7, 1864",New York Times (1857-1922),1864,http://search.proquest.com/docview/91865806?accountid=13567, 1,http://openurl.lib.rochester.edu/find?ctx_ver=Z39.88-2004&amp;ctx_enc=info:ofi/enc:UTF-8&amp;rfr_id=info:sid/ProQ%3Ahnpnewyorktimeswindex&amp;rft_val_fmt=info:ofi/fmt:kev:mtx:journal&amp;rft.genre=unknown&amp;rft.jtitle=New+York+Times+%281857-1922%29&amp;rft.atitle=Casualties+in+the+Forty-eighth+New-York+Volunteers+in+Engagement+before+Petersburgh%2C+July+30%2C+1864.&amp;rft.au=&amp;rft.aulast=&amp;rft.aufirst=&amp;rft.date=1864-08-07&amp;rft.volume=&amp;rft.issue=&amp;rft.spage=1&amp;rft.isbn=&amp;rft.btitle=&amp;rft.title=New+York+Times+%281857-1922%29&amp;rft.issn=03624331,ProQuest Historical Newspapers: The New York Times (1851-2009) with Index (1851-1993)
THE ASSAULT AT PETERSBURGH.,The following letters received in this City give interesting unprofessional accounts of the recent assault at Petersburgh:,91864431,Historical Newspapers," Copyright New York Times Company Aug 7, 1864"," 80297278-1 , 1459079 , 113715", front_page," Aug 7, 1864",0362-4331, English, English, 1," New York, N.Y.","Aug 7, 1864",New York Times (1857-1922),1864,http://search.proquest.com/docview/91864431?accountid=13567, 1,http://openurl.lib.rochester.edu/find?ctx_ver=Z39.88-2004&amp;ctx_enc=info:ofi/enc:UTF-8&amp;rfr_id=info:sid/ProQ%3Ahnpnewyorktimeswindex&amp;rft_val_fmt=info:ofi/fmt:kev:mtx:journal&amp;rft.genre=unknown&amp;rft.jtitle=New+York+Times+%281857-1922%29&amp;rft.atitle=THE+ASSAULT+AT+PETERSBURGH.%3A+INTERESTING+ACCOUNT+FROM+PRIVATE+SOURCES.&amp;rft.au=&amp;rft.aulast=&amp;rft.aufirst=&amp;rft.date=1864-08-07&amp;rft.volume=&amp;rft.issue=&amp;rft.spage=1&amp;rft.isbn=&amp;rft.btitle=&amp;rft.title=New+York+Times+%281857-1922%29&amp;rft.issn=03624331,ProQuest Historical Newspapers: The New York Times (1851-2009) with Index (1851-1993)
THE BOMBARDMENT OF PETERSBURGH.,"What advantage GRANT hopes to gain from knocking holes through the dwellings of Petersburgh, no intelligent man can conceive. Knocking two windows into one, and smashing up furniture, do not tend to soften a Southern man's dislike of Northern association, but, on the contrary, intensifies his hatred by adding personal to political wrongs. The fact disclosed of the hurrying of men to Virginia demonstrates one thing, namely, that GRANT is conscious of his weakness. He set out with a force of some two hundred thousand men, all told, and having lost one-third of it, is now holding back until he shall be able to replenish his army, and prepare ...",91872076,Historical Newspapers," Copyright New York Times Company Aug 7, 1864"," 80297302 , 1459079 , 113715", article," Aug 7, 1864",0362-4331, English, English, 2," New York, N.Y.","Aug 7, 1864",New York Times (1857-1922),1864,http://search.proquest.com/docview/91872076?accountid=13567, 2,http://openurl.lib.rochester.edu/find?ctx_ver=Z39.88-2004&amp;ctx_enc=info:ofi/enc:UTF-8&amp;rfr_id=info:sid/ProQ%3Ahnpnewyorktimeswindex&amp;rft_val_fmt=info:ofi/fmt:kev:mtx:journal&amp;rft.genre=article&amp;rft.jtitle=New+York+Times+%281857-1922%29&amp;rft.atitle=THE+BOMBARDMENT+OF+PETERSBURGH.%3A+WHAT+WAS+THOUGHT+OF+GRANT%27S+INTENTIONS+BEFORE+THE+BATTLE.&amp;rft.au=&amp;rft.aulast=&amp;rft.aufirst=&amp;rft.date=1864-08-07&amp;rft.volume=&amp;rft.issue=&amp;rft.spage=2&amp;rft.isbn=&amp;rft.btitle=&amp;rft.title=New+York+Times+%281857-1922%29&amp;rft.issn=03624331,ProQuest Historical Newspapers: The New York Times (1851-2009) with Index (1851-1993)
GEN. GRANT'S ARMY,"A flag of truce was allowed by the rebels from 9 until 5 o'clock this morning, to bury the dead and bring off the wounded.",91879647,Historical Newspapers," Copyright New York Times Company Aug 4, 1864"," 78728708 , 1446361 , 113715", front_page," Aug 4, 1864",0362-4331, English, English, 1," New York, N.Y.","Aug 4, 1864",New York Times (1857-1922),1864,http://search.proquest.com/docview/91879647?accountid=13567, 1,http://openurl.lib.rochester.edu/find?ctx_ver=Z39.88-2004&amp;ctx_enc=info:ofi/enc:UTF-8&amp;rfr_id=info:sid/ProQ%3Ahnpnewyorktimeswindex&amp;rft_val_fmt=info:ofi/fmt:kev:mtx:journal&amp;rft.genre=unknown&amp;rft.jtitle=New+York+Times+%281857-1922%29&amp;rft.atitle=GEN.+GRANT%27S+ARMY%3A+BURYING+THE+DEAD+UNDER+FLAG+OF+TRUCE.+THE+REBELS+CLAIM+TO+HAVE+1%2C200+PRISONERS.+ALLEGED+HEAVY+LOSS+OF+THE+ENEMY.&amp;rft.au=&amp;rft.aulast=&amp;rft.aufirst=&amp;rft.date=1864-08-04&amp;rft.volume=&amp;rft.issue=&amp;rft.spage=1&amp;rft.isbn=&amp;rft.btitle=&amp;rft.title=New+York+Times+%281857-1922%29&amp;rft.issn=03624331,ProQuest Historical Newspapers: The New York Times (1851-2009) with Index (1851-1993)
FROM PETERSBURGH.,"The exact losses in the battle of yesterday, before Petersburgh, have not yet been officially ascertained, but as near as can be judged, they will foot up about 2,500, not including the missing, and many believe that the figures will turn out to be larger.",91873740,Historical Newspapers," Copyright New York Times Company Aug 3, 1864"," 78728605 , 1446360 , 113715", front_page," Aug 3, 1864",0362-4331, English, English, 1," New York, N.Y.","Aug 3, 1864",New York Times (1857-1922),1864,http://search.proquest.com/docview/91873740?accountid=13567, 1,http://openurl.lib.rochester.edu/find?ctx_ver=Z39.88-2004&amp;ctx_enc=info:ofi/enc:UTF-8&amp;rfr_id=info:sid/ProQ%3Ahnpnewyorktimeswindex&amp;rft_val_fmt=info:ofi/fmt:kev:mtx:journal&amp;rft.genre=unknown&amp;rft.jtitle=New+York+Times+%281857-1922%29&amp;rft.atitle=FROM+PETERSBURGH.%3A+OUR+LOSS+IN+SATURDAY%27S+BATTLE+2%2C500%2C+NOT+INCLUDING+THE+MISSING.+SOME+OF+THE+WOUNDED+STILL+ON+THE+FIELD.+TWO+HUNDRED+AND+FIFTY-TWO+REBELS+CAPTURED.+A+FLAG+OF+TRUCE+REFUSED%2C+BUT+SUBSEQUENTLY+GRANTED.NATIONAL+PRISONERS+AT+LYNCHBUBGH.+SECOND+DISPATCH.&amp;rft.au=&amp;rft.aulast=&amp;rft.aufirst=&amp;rft.date=1864-08-03&amp;rft.volume=&amp;rft.issue=&amp;rft.spage=1&amp;rft.isbn=&amp;rft.btitle=&amp;rft.title=New+York+Times+%281857-1922%29&amp;rft.issn=03624331,ProQuest Historical Newspapers: The New York Times (1851-2009) with Index (1851-1993)
ARMY OF THE POTOMAC,"The failure of the assault on the lines of Petersburgh last Saturday morning, seems to have produced, in reflecting minds, a sentiment of despondency out of all proportion with its mere material loss, as compared with other losses in former assaults on the enemy's positions, and seemingly independent of any features of the affair that lie on the surface. This fact invites",91861162,Historical Newspapers," Copyright New York Times Company Aug 3, 1864"," 78728602-1 , 1446360 , 113715", front_page," Aug 3, 1864",0362-4331, English, English, 1," New York, N.Y.","Aug 3, 1864",New York Times (1857-1922),1864,http://search.proquest.com/docview/91861162?accountid=13567, 1,http://openurl.lib.rochester.edu/find?ctx_ver=Z39.88-2004&amp;ctx_enc=info:ofi/enc:UTF-8&amp;rfr_id=info:sid/ProQ%3Ahnpnewyorktimeswindex&amp;rft_val_fmt=info:ofi/fmt:kev:mtx:journal&amp;rft.genre=unknown&amp;rft.jtitle=New+York+Times+%281857-1922%29&amp;rft.atitle=ARMY+OF+THE+POTOMAC%3A+SATURDAY%27S+ASSAULT.+GENERAL+MILITARY+REVIEW+OF+THE+ACTION.+THE+FAILURE+AND+ITS+CAUSES.+THE+VIRGINIA+CAMPAIGN+AS+IT+NOW+STANDS.&amp;rft.au=&amp;rft.aulast=&amp;rft.aufirst=&amp;rft.date=1864-08-03&amp;rft.volume=&amp;rft.issue=&amp;rft.spage=1&amp;rft.isbn=&amp;rft.btitle=&amp;rft.title=New+York+Times+%281857-1922%29&amp;rft.issn=03624331,ProQuest Historical Newspapers: The New York Times (1851-2009) with Index (1851-1993)
NEWS FROM WASHINGTON.,"Great disgust is expressed by the authorities at the highly colored dispatches published in the extras of yesterday morning, regarding the engagement of Saturday before Petersburgh. It is felt that such reports do infinite damage to the Union cause, as the reaction of despondency is always proportionate to the undue hopes excited.",91817295,Historical Newspapers," Copyright New York Times Company Aug 2, 1864"," 78728490-1 , 1446359 , 113715", front_page," Aug 2, 1864",0362-4331, English, English, 1," New York, N.Y.","Aug 2, 1864",New York Times (1857-1922),1864,http://search.proquest.com/docview/91817295?accountid=13567, 1,http://openurl.lib.rochester.edu/find?ctx_ver=Z39.88-2004&amp;ctx_enc=info:ofi/enc:UTF-8&amp;rfr_id=info:sid/ProQ%3Ahnpnewyorktimeswindex&amp;rft_val_fmt=info:ofi/fmt:kev:mtx:journal&amp;rft.genre=unknown&amp;rft.jtitle=New+York+Times+%281857-1922%29&amp;rft.atitle=NEWS+FROM+WASHINGTON.%3A+FEELING+IN+WASHINGTON.+THE+DESTRUCTION+OF+CHAMBERSBURGH.+THE+FAILURE+BEFORE+PETERSBURGH.+GEN.+GRANT%27S+CONFIDENCE.+RUMORED+REBEL+MOVEMENTS.+REVENUE+DECISIONS.+THE+RESERVE+CORPS.+BIDS+FOR+SUPPLIES+TO+THE+NAVY-YARDS.+GEN.+BURNSIDE+WOUNDED.+REPORTED+DEATH+OF+COL.+CURTIN.+DEATH+OF+GEN.+SHERMAN%27S+FATHER.+ARRIVAL+OF+SICK+AND+WOUNDED.+SUBSCRIPTIONS+TO+THE+NEW+LOAN.+MAILS+FOR+THE+WEST+GULF+SQUADRON.&amp;rft.au=&amp;rft.aulast=&amp;rft.aufirst=&amp;rft.date=1864-08-02&amp;rft.volume=&amp;rft.issue=&amp;rft.spage=1&amp;rft.isbn=&amp;rft.btitle=&amp;rft.title=New+York+Times+%281857-1922%29&amp;rft.issn=03624331,ProQuest Historical Newspapers: The New York Times (1851-2009) with Index (1851-1993)
THE PETERSBURG LINES,,91810166,Historical Newspapers," Copyright New York Times Company Aug 2, 1864"," 78728486 , 1446359 , 113715", banner," Aug 2, 1864",0362-4331, English, English, 1," New York, N.Y.","Aug 2, 1864",New York Times (1857-1922),1864,http://search.proquest.com/docview/91810166?accountid=13567, 1,http://openurl.lib.rochester.edu/find?ctx_ver=Z39.88-2004&amp;ctx_enc=info:ofi/enc:UTF-8&amp;rfr_id=info:sid/ProQ%3Ahnpnewyorktimeswindex&amp;rft_val_fmt=info:ofi/fmt:kev:mtx:journal&amp;rft.genre=unknown&amp;rft.jtitle=New+York+Times+%281857-1922%29&amp;rft.atitle=THE+PETERSBURG+LINES&amp;rft.au=&amp;rft.aulast=&amp;rft.aufirst=&amp;rft.date=1864-08-02&amp;rft.volume=&amp;rft.issue=&amp;rft.spage=1&amp;rft.isbn=&amp;rft.btitle=&amp;rft.title=New+York+Times+%281857-1922%29&amp;rft.issn=03624331,ProQuest Historical Newspapers: The New York Times (1851-2009) with Index (1851-1993)
The Assault by Our Troops on Saturday.,"After the explosion at an early hour this morning, everything betokened a brilliant victory, but soon after matters assumed a different aspect, part of the attacking force having given way, thus exposing the balance to an enfilading fire from both artillery, and infantry.",91815295,Historical Newspapers," Copyright New York Times Company Aug 2, 1864"," 78728502-1 , 1446359 , 113715", front_page," Aug 2, 1864",0362-4331, English, English, 1," New York, N.Y.","Aug 2, 1864",New York Times (1857-1922),1864,http://search.proquest.com/docview/91815295?accountid=13567, 1,http://openurl.lib.rochester.edu/find?ctx_ver=Z39.88-2004&amp;ctx_enc=info:ofi/enc:UTF-8&amp;rfr_id=info:sid/ProQ%3Ahnpnewyorktimeswindex&amp;rft_val_fmt=info:ofi/fmt:kev:mtx:journal&amp;rft.genre=unknown&amp;rft.jtitle=New+York+Times+%281857-1922%29&amp;rft.atitle=The+Assault+by+Our+Troops+on+Saturday.%3A+Desperate+Attempt+to+Carry+the+Enemy%27s+Position.+FAILURE+OF+THE+ATTEMPT+The+Colored+Troops+Charged+With+the+Failure.+The+Loss+on+Both+Sides+Between+Four+and+Five+Thousand.+A+Detailed+Sketch+of+the+Whole+Matter.+FIRST+DISPATCH.+TWENTY-THIRD+UNITED+STATES%2C+COLORED.+TWENTY-EIGHTH+UNITED+STATES%2C+COLORED.+TWENTY-SEVENTH+U.S.+COLORED.+TWENTY-NINTH+U.S.+COLORED.+THIRTY-FIRST+U.S.+COLORED.+FORTY-THIRD+U.S.+COLORED.+THIRTY-NINTH+U.S.+COLORED.+SECOND+DISPATCH.&amp;rft.au=&amp;rft.aulast=&amp;rft.aufirst=&amp;rft.date=1864-08-02&amp;rft.volume=&amp;rft.issue=&amp;rft.spage=1&amp;rft.isbn=&amp;rft.btitle=&amp;rft.title=New+York+Times+%281857-1922%29&amp;rft.issn=03624331,ProQuest Historical Newspapers: The New York Times (1851-2009) with Index (1851-1993)
The Assault--Its Character and Results.,"I am called to the fulfillment of an ungracious task to-night. Instead of success and victory which the morning fairly promised, I have to write of disaster and defeat. To-day's brief history affords another",91806880,Historical Newspapers," Copyright New York Times Company Aug 2, 1864"," 78728488 , 1446359 , 113715", front_page," Aug 2, 1864",0362-4331, English, English, 1," New York, N.Y.","Aug 2, 1864",New York Times (1857-1922),1864,http://search.proquest.com/docview/91806880?accountid=13567, 1,http://openurl.lib.rochester.edu/find?ctx_ver=Z39.88-2004&amp;ctx_enc=info:ofi/enc:UTF-8&amp;rfr_id=info:sid/ProQ%3Ahnpnewyorktimeswindex&amp;rft_val_fmt=info:ofi/fmt:kev:mtx:journal&amp;rft.genre=unknown&amp;rft.jtitle=New+York+Times+%281857-1922%29&amp;rft.atitle=The+Assault--Its+Character+and+Results.&amp;rft.au=&amp;rft.aulast=&amp;rft.aufirst=&amp;rft.date=1864-08-02&amp;rft.volume=&amp;rft.issue=&amp;rft.spage=1&amp;rft.isbn=&amp;rft.btitle=&amp;rft.title=New+York+Times+%281857-1922%29&amp;rft.issn=03624331,ProQuest Historical Newspapers: The New York Times (1851-2009) with Index (1851-1993)
The Action at Petersburgh.,"The attempt on the lines of Petereburgh on Saturday did not result in a success. It was an effort whose success or failure must occur at once, and must at once be apparent.",91810243,Historical Newspapers," Copyright New York Times Company Aug 2, 1864"," 78728543-1 , 1446359 , 113715", editorial_article," Aug 2, 1864",0362-4331, English, English, 4," New York, N.Y.","Aug 2, 1864",New York Times (1857-1922),1864,http://search.proquest.com/docview/91810243?accountid=13567, 4,http://openurl.lib.rochester.edu/find?ctx_ver=Z39.88-2004&amp;ctx_enc=info:ofi/enc:UTF-8&amp;rfr_id=info:sid/ProQ%3Ahnpnewyorktimeswindex&amp;rft_val_fmt=info:ofi/fmt:kev:mtx:journal&amp;rft.genre=unknown&amp;rft.jtitle=New+York+Times+%281857-1922%29&amp;rft.atitle=The+Action+at+Petersburgh.&amp;rft.au=&amp;rft.aulast=&amp;rft.aufirst=&amp;rft.date=1864-08-02&amp;rft.volume=&amp;rft.issue=&amp;rft.spage=4&amp;rft.isbn=&amp;rft.btitle=&amp;rft.title=New+York+Times+%281857-1922%29&amp;rft.issn=03624331,ProQuest Historical Newspapers: The New York Times (1851-2009) with Index (1851-1993)
THE REBELLION.,"From Petersburgh our news is not of the success anticipated. After the explosion, at an early hour on Saturday morning, everything betokened a brilliant victory; but by the failure of the colored troops to carry out their part of the programme, affairs began to wear a different aspect.",91806942,Historical Newspapers," Copyright New York Times Company Aug 2, 1864"," 78728541 , 1446359 , 113715", editorial_article," Aug 2, 1864",0362-4331, English, English, 4," New York, N.Y.","Aug 2, 1864",New York Times (1857-1922),1864,http://search.proquest.com/docview/91806942?accountid=13567, 4,http://openurl.lib.rochester.edu/find?ctx_ver=Z39.88-2004&amp;ctx_enc=info:ofi/enc:UTF-8&amp;rfr_id=info:sid/ProQ%3Ahnpnewyorktimeswindex&amp;rft_val_fmt=info:ofi/fmt:kev:mtx:journal&amp;rft.genre=unknown&amp;rft.jtitle=New+York+Times+%281857-1922%29&amp;rft.atitle=THE+REBELLION.&amp;rft.au=&amp;rft.aulast=&amp;rft.aufirst=&amp;rft.date=1864-08-02&amp;rft.volume=&amp;rft.issue=&amp;rft.spage=4&amp;rft.isbn=&amp;rft.btitle=&amp;rft.title=New+York+Times+%281857-1922%29&amp;rft.issn=03624331,ProQuest Historical Newspapers: The New York Times (1851-2009) with Index (1851-1993)
GENERAL NEWS.,"It is worthy of notice that the first brigade to enter the Petersburgh fort after the explosion was the Forteenth New-York Heavy Artillery, the Second brigade of LEDLIE'S division, commanded by Col. ELISHA G. MARSHALL. This brigade also stormed the rifle-pits before Petersburgh, and bore an important part in the successful assault on the second line of rebel works. It is now found again at the post of honor and of danger. Col. MARSHALL, acting-brigadies, is a native of New-York, and was educated at West Point.",91810088,Historical Newspapers," Copyright New York Times Company Aug 2, 1864"," 78728542-1 , 1446359 , 113715", editorial_article," Aug 2, 1864",0362-4331, English, English, 4," New York, N.Y.","Aug 2, 1864",New York Times (1857-1922),1864,http://search.proquest.com/docview/91810088?accountid=13567, 4,http://openurl.lib.rochester.edu/find?ctx_ver=Z39.88-2004&amp;ctx_enc=info:ofi/enc:UTF-8&amp;rfr_id=info:sid/ProQ%3Ahnpnewyorktimeswindex&amp;rft_val_fmt=info:ofi/fmt:kev:mtx:journal&amp;rft.genre=unknown&amp;rft.jtitle=New+York+Times+%281857-1922%29&amp;rft.atitle=GENERAL+NEWS.&amp;rft.au=&amp;rft.aulast=&amp;rft.aufirst=&amp;rft.date=1864-08-02&amp;rft.volume=&amp;rft.issue=&amp;rft.spage=4&amp;rft.isbn=&amp;rft.btitle=&amp;rft.title=New+York+Times+%281857-1922%29&amp;rft.issn=03624331,ProQuest Historical Newspapers: The New York Times (1851-2009) with Index (1851-1993)
PETERSBURGH.,"Dispatches from the TIMES' special army correspondent, herewith transmitted, bring before the imagination the opening of a grand battle drama, which began with early dawn of Saturday. Unlike customary skirmishing, with which the first sallies of battle begin, the combat of Saturday opens midst explosion of mines and the rude clamor of a hundred pieces of artillery.",91846860,Historical Newspapers," Copyright New York Times Company Aug 1, 1864"," 80296963-1 , 1459078 , 113715", front_page," Aug 1, 1864",0362-4331, English, English, 1," New York, N.Y.","Aug 1, 1864",New York Times (1857-1922),1864,http://search.proquest.com/docview/91846860?accountid=13567, 1,http://openurl.lib.rochester.edu/find?ctx_ver=Z39.88-2004&amp;ctx_enc=info:ofi/enc:UTF-8&amp;rfr_id=info:sid/ProQ%3Ahnpnewyorktimeswindex&amp;rft_val_fmt=info:ofi/fmt:kev:mtx:journal&amp;rft.genre=unknown&amp;rft.jtitle=New+York+Times+%281857-1922%29&amp;rft.atitle=PETERSBURGH.%3A+GREAT+AND+ACTIVE+OPERATIONS.+SPRINGING+OF+A+MINE+UNDER+THE+REBEL+WORKS.+SIMULTANEOUS+OPENING+OF+A+HUNDRED+PIECES+OF+ARTILLERY.+OUR+TROOPS+CHARGE+THE+REBEL+WORKS+AND+CARRY+THE+FIRST+LINE.+THE+BATTLE+IN+PROGRESS+OPERATIONS+ON+THE+NORTH+BANK+OF+THE+JAMES.+THE+FEINT+OF+GENERALS+HANCOCK+AND+SHERIDAN.+RETURN+OF+OUR+TROOPS.+THE+STRATEGICAL+COMBINATIONS+OF+THE+CAMPAIGN.+A+SURVEY+OF+AFFAIRS+ACCOUNTS+BY+OUR+SPECIAL+ARMY+CORRESPONDENTS.&amp;rft.au=&amp;rft.aulast=&amp;rft.aufirst=&amp;rft.date=1864-08-01&amp;rft.volume=&amp;rft.issue=&amp;rft.spage=1&amp;rft.isbn=&amp;rft.btitle=&amp;rft.title=New+York+Times+%281857-1922%29&amp;rft.issn=03624331,ProQuest Historical Newspapers: The New York Times (1851-2009) with Index (1851-1993)
Success of the Movement North of the James--Guns and Prisoners Captured Near Malvern Hill--The Rebels Anticipating a Hoist from Grant's Mines.,"The mailboat Charlotte Vanderbilt arrived here yesterday from City Point. She brings no definite news of the further operations of the Second Corps since the fighting at Malvern Hill, but it was reported at City Point that our forces were moving on successfully, and had advanced some distance up river above the point of the late fighting.",91849266,Historical Newspapers," Copyright New York Times Company Aug 1, 1864"," 80296967 , 1459078 , 113715", front_page," Aug 1, 1864",0362-4331, English, English, 1," New York, N.Y.","Aug 1, 1864",New York Times (1857-1922),1864,http://search.proquest.com/docview/91849266?accountid=13567, 1,http://openurl.lib.rochester.edu/find?ctx_ver=Z39.88-2004&amp;ctx_enc=info:ofi/enc:UTF-8&amp;rfr_id=info:sid/ProQ%3Ahnpnewyorktimeswindex&amp;rft_val_fmt=info:ofi/fmt:kev:mtx:journal&amp;rft.genre=unknown&amp;rft.jtitle=New+York+Times+%281857-1922%29&amp;rft.atitle=Success+of+the+Movement+North+of+the+James--Guns+and+Prisoners+Captured+Near+Malvern+Hill--The+Rebels+Anticipating+a+Hoist+from+Grant%27s+Mines.&amp;rft.au=&amp;rft.aulast=&amp;rft.aufirst=&amp;rft.date=1864-08-01&amp;rft.volume=&amp;rft.issue=&amp;rft.spage=1&amp;rft.isbn=&amp;rft.btitle=&amp;rft.title=New+York+Times+%281857-1922%29&amp;rft.issn=03624331,ProQuest Historical Newspapers: The New York Times (1851-2009) with Index (1851-1993)
The Scope of the New Invasion.,It would be vain to attempt to found a theory of the new incursion of EARLY'S raiders into the districts of the Upper Potomac from any one of the disjointed reports which the telegraph has been permitted to convey to the public.,91887022,Historical Newspapers," Copyright New York Times Company Aug 1, 1864"," 80297076-1 , 1459078 , 113715", editorial_article," Aug 1, 1864",0362-4331, English, English, 4," New York, N.Y.","Aug 1, 1864",New York Times (1857-1922),1864,http://search.proquest.com/docview/91887022?accountid=13567, 4,http://openurl.lib.rochester.edu/find?ctx_ver=Z39.88-2004&amp;ctx_enc=info:ofi/enc:UTF-8&amp;rfr_id=info:sid/ProQ%3Ahnpnewyorktimeswindex&amp;rft_val_fmt=info:ofi/fmt:kev:mtx:journal&amp;rft.genre=unknown&amp;rft.jtitle=New+York+Times+%281857-1922%29&amp;rft.atitle=The+Scope+of+the+New+Invasion.&amp;rft.au=&amp;rft.aulast=&amp;rft.aufirst=&amp;rft.date=1864-08-01&amp;rft.volume=&amp;rft.issue=&amp;rft.spage=4&amp;rft.isbn=&amp;rft.btitle=&amp;rft.title=New+York+Times+%281857-1922%29&amp;rft.issn=03624331,ProQuest Historical Newspapers: The New York Times (1851-2009) with Index (1851-1993)
Before Petersburgh.,"The pirouettings of the rebel brigands north of the Potomac assume their proper and insignificant magnitude this morning alongside of the great operations which Gen. GRANT has inaugurated before Petersburgh. He has, in a two-fold sense, sprung a mine upon the rebels.",91849523,Historical Newspapers," Copyright New York Times Company Aug 1, 1864"," 80297072 , 1459078 , 113715", editorial_article," Aug 1, 1864",0362-4331, English, English, 4," New York, N.Y.","Aug 1, 1864",New York Times (1857-1922),1864,http://search.proquest.com/docview/91849523?accountid=13567, 4,http://openurl.lib.rochester.edu/find?ctx_ver=Z39.88-2004&amp;ctx_enc=info:ofi/enc:UTF-8&amp;rfr_id=info:sid/ProQ%3Ahnpnewyorktimeswindex&amp;rft_val_fmt=info:ofi/fmt:kev:mtx:journal&amp;rft.genre=unknown&amp;rft.jtitle=New+York+Times+%281857-1922%29&amp;rft.atitle=Before+Petersburgh.&amp;rft.au=&amp;rft.aulast=&amp;rft.aufirst=&amp;rft.date=1864-08-01&amp;rft.volume=&amp;rft.issue=&amp;rft.spage=4&amp;rft.isbn=&amp;rft.btitle=&amp;rft.title=New+York+Times+%281857-1922%29&amp;rft.issn=03624331,ProQuest Historical Newspapers: The New York Times (1851-2009) with Index (1851-1993)
